url,category,comment,hate_towards_whom,label
https://www.youtube.com/watch?v=ueYDVFO-m6M,entertainment,"She said, “I used to lift up my skirt…” and some dude goes “Woo!” Then she says, “but I was 3 years old.” and then the same dude goes “Woo!” again seems sus",Individual (A guest audience),yes
https://www.youtube.com/watch?v=ueYDVFO-m6M,entertainment,That man who wooed didn’t think before so because he will forever be know by every in that audience,Individual (A guest audience),yes
https://www.youtube.com/watch?v=ueYDVFO-m6M,entertainment,I initially found Nikki Glazer edgy and funny. Now its like her whole act is trying to shock people. She is just a blond Sarah Silverman,"Individual (Nikki Glazer), Individual (Sarah Silverman)",yes
https://www.youtube.com/watch?v=ueYDVFO-m6M,entertainment,It's funny how most of the sexual innuendos came from women.,Community (Women),yes
https://www.youtube.com/watch?v=ueYDVFO-m6M,entertainment,"Double standards. Most of these guests were female so it's OK. If a guy said those things, it would be ""creepy. """,Individual (Host),yes
https://www.youtube.com/watch?v=glR4fKs7WSU,fashion & beauty,"WTACTUALF did i just witness. If this is considered art/fashion. We are doomed for sure, in more ways than one.",Individual,yes
https://www.youtube.com/watch?v=glR4fKs7WSU,fashion & beauty,"This dude is surely Satan's offspring, who comes up with this??",Individual (Jef Montes),yes
https://www.youtube.com/watch?v=glR4fKs7WSU,fashion & beauty,Fantastic designer it’s a bunch of rags LOL,Individual (Jef Montes),yes
https://www.youtube.com/watch?v=glR4fKs7WSU,fashion & beauty,Who in the right mind buys this? Designers would surely bring the end of the world,Community (Designers),yes
https://www.youtube.com/watch?v=glR4fKs7WSU,fashion & beauty,1:53 best of all,Individual,yes
https://www.youtube.com/watch?v=glR4fKs7WSU,fashion & beauty,"clean out all the Artists, before they torment humanity",Community (Artists),yes
https://www.youtube.com/watch?v=HKlt2vpnzdU,fashion & beauty,"I get how they cover the tattoos, but how do they cover the Adam's apple?",Individual,yes
https://www.youtube.com/watch?v=HKlt2vpnzdU,fashion & beauty,Better title is Christmass duck transformation.,Individual,yes
https://www.youtube.com/watch?v=HKlt2vpnzdU,fashion & beauty,Might as well just wear a bag over their head,Individual,yes
https://www.youtube.com/watch?v=HKlt2vpnzdU,fashion & beauty,Nothing beautiful about lip injections 🤮,Individual,yes
https://www.youtube.com/watch?v=HKlt2vpnzdU,fashion & beauty,Why everyone wants to look like plastic??,Community,yes
https://www.youtube.com/watch?v=HKlt2vpnzdU,fashion & beauty,She looks alot better by covering those tattoos. Just goes to show how ugly tattoos really are.,Community (Tattoos),yes
https://www.youtube.com/watch?v=HKlt2vpnzdU,fashion & beauty,That's a DUDE,Individual,yes
https://www.youtube.com/watch?v=Txqq8q5-cRA,entertainment,Did anybody notice how creepy North's charcoal drawing was. Lol,Individual (North West),yes
https://www.youtube.com/watch?v=Txqq8q5-cRA,entertainment,All that white is a nightmare 😫,Individual,yes
https://www.youtube.com/watch?v=Txqq8q5-cRA,entertainment,it feels like museum not a house,Individual,yes
https://www.youtube.com/watch?v=Txqq8q5-cRA,entertainment,"6:15 making yours cars blend in, is just flaunting money and going to much overboard. Who does tha??",Individual,yes
https://www.youtube.com/watch?v=Txqq8q5-cRA,entertainment,"It seems all this is for show only, just for the camera. NO Place has everything this perfect",Individual,yes
https://www.youtube.com/watch?v=0SgXbFjzZGM,entertainment,Who cares about boring couples the never have baby together,"Individual (Justin Beiber, Hailey Beiber)",yes
https://www.youtube.com/watch?v=0SgXbFjzZGM,entertainment,"2 kids having kids , not ideal!","Individual (Justin Beiber, Hailey Beiber)",yes
https://www.youtube.com/watch?v=0SgXbFjzZGM,entertainment,She is out of her mind 😜 😳,Individual (Hailey Beiber),yes
https://www.youtube.com/watch?v=0SgXbFjzZGM,entertainment,She getting attention after her marriage.her real career just started,Individual (Hailey Beiber),yes
https://www.youtube.com/watch?v=0SgXbFjzZGM,entertainment,Isn’t he gone or am I thinking of someone else or a different singer,Individual (Justin Beiber),yes
https://www.bitchute.com/video/PbQ2FwGZFYOm/,news & politics,The People Featured In This Video Are The Real Terrorist Of Canada,"Individual (Justin Trudeau, Chrystia Freeland)",yes
https://www.bitchute.com/video/PbQ2FwGZFYOm/,news & politics,Canada: A Communist Country.,Location (Canada),yes
https://www.bitchute.com/video/PbQ2FwGZFYOm/,news & politics,The cult even has its own accents. I can recognize a woke cultist as soon as they begin speaking.,Individual (Chrystia Freeland),yes
https://www.bitchute.com/video/PbQ2FwGZFYOm/,news & politics,"""Minister Freeland"" = kyke controlling your bank account.",Individual (Chrystia Freeland),yes
https://www.bitchute.com/video/PbQ2FwGZFYOm/,news & politics,"woman seem to be as cunning, in positions of power, as men are.",Community (Women),yes
https://www.bitchute.com/video/PbQ2FwGZFYOm/,news & politics,"Worse, cause they stand on a thicker layer of double standards.
Which means less integrity and balance of right and wrong.",Community (Women),yes
https://www.bitchute.com/video/PbQ2FwGZFYOm/,news & politics,"The only place a female belongs is either in the kitchen, bedroom, or nursery. End of!",Community (Women),yes
https://www.bitchute.com/video/PbQ2FwGZFYOm/,news & politics,Hitler and Stalin and the Devil are so proud of these politicians.,"Individual (Justin Trudeau, Chrystia Freeland)",yes
https://www.bitchute.com/video/PbQ2FwGZFYOm/,news & politics,The four-foot Freeland is outright plain bad news.,Individual (Chrystia Freeland),yes
https://www.bitchute.com/video/PbQ2FwGZFYOm/,news & politics,praying for the truckers!! Irritating! Hold the line Patriots! We will have them on the ropes!,Community (Canadian Truckers),yes
https://www.youtube.com/watch?v=BhSucJ1KDcU,fashion & beauty,Fat shaming should be a Civic Duty.,Community (Fat People),yes
https://www.youtube.com/watch?v=BhSucJ1KDcU,fashion & beauty,Kim is bad model. Age 41,Individual (Kim kardashian),yes
https://www.youtube.com/watch?v=BhSucJ1KDcU,fashion & beauty,Vogue you are part of the problem too. Too little too late. Two-faced company.,Organisation (Vogue),yes
https://www.youtube.com/watch?v=BhSucJ1KDcU,fashion & beauty,They featured kim in this. She should be ashamed of herself.,Individual (Kim kardashian),yes
https://www.youtube.com/watch?v=BhSucJ1KDcU,fashion & beauty,then stop editing so much vogue. start there.,Organisation (Vogue),yes
https://www.youtube.com/watch?v=BhSucJ1KDcU,fashion & beauty,"Why is kim here, it's not her body it was made in a lab",Individual (Kim kardashian),yes
https://www.youtube.com/watch?v=BhSucJ1KDcU,fashion & beauty,they put a sample sized top model in the post credits. Goes to show how much thought went into creating this video.,Organisation (Vogue),yes
https://www.youtube.com/watch?v=BhSucJ1KDcU,fashion & beauty,Un sorry I can’t unsee this. mindless pretenders.,Organisation (Vogue),yes
https://www.youtube.com/watch?v=PmHS78gMXIo,fashion & beauty,"I love coco chanel saying knees are the ugliest feature because I might argue that, I don't know, nazism is the ugliest feature?",Individual (Coco chanel),yes
https://www.youtube.com/watch?v=PmHS78gMXIo,fashion & beauty,4:56 what the heck is this? They have gone too far.,Community (Homosexual males),yes
https://www.youtube.com/watch?v=guNR0Lw0HP0,news & politics,"This reaction by the mass media is totally opposite of how they acted when the US launched ""shock and awe"" on Baghdad. Anyone care to explain that?",Organisation (Media),yes
https://www.youtube.com/watch?v=guNR0Lw0HP0,news & politics,Putin doesn’t fear America anymore. Why would he? America has the weakest leader in the whole world right now. He’s the weakest president in America’s history,Individual (Joe Biden),yes
https://www.youtube.com/watch?v=guNR0Lw0HP0,news & politics,"Putin is secretly trying to build the USSR back together, Putin is new Stalin.",Individual (Putin),yes
https://www.youtube.com/watch?v=guNR0Lw0HP0,news & politics,Once the boomers are gone then we’ll be fine,Community (Boomers),yes
https://www.youtube.com/watch?v=wxONn_fPsB4,news & politics,Just a gimmick to get some money and stay in the public eye,"Individual (Melania Trump, Donald Trump)",yes
https://www.youtube.com/watch?v=wxONn_fPsB4,news & politics,"Now we know folks, why it looks bad",Individual (Donald Trump),yes
https://www.youtube.com/watch?v=wxONn_fPsB4,news & politics,I'll buy a pillow instead,"Individual (Melania Trump, Donald Trump), Community (NFT)",yes
https://www.youtube.com/watch?v=wxONn_fPsB4,news & politics,"What the ff $50.00 each painting? That's OUTRAGEOUS....IMPEACH, wait he is not the president","Individual (Donald Trump), Community (NFT)",yes
https://www.youtube.com/watch?v=wxONn_fPsB4,news & politics,Always about the money,"Individual (Melania Trump, Donald Trump)",yes
https://www.youtube.com/watch?v=wxONn_fPsB4,news & politics,She is a damn robot,Individual (Melania Trump),yes
https://www.youtube.com/watch?v=m2kOu6J2Zhc,sports,some would say she's a true master at making poles bend to her will. Fantasstic performance.,Individual (Clara Fernandez),yes
https://www.youtube.com/watch?v=m2kOu6J2Zhc,sports,She rode that pole hard and finished strong. She raises everybody up. I hope she continues to ride poles for a very long time.,Individual (Clara Fernandez),yes
https://www.youtube.com/watch?v=m2kOu6J2Zhc,sports,"Such a well rounded athlete, we men sure love the fine sport of pole vaulting",Individual (Clara Fernandez),yes
https://www.youtube.com/watch?v=m2kOu6J2Zhc,sports,That cameraman truly knows how to keep up with the athlete’s well-rounded performance.,Individual (Clara Fernandez and cameraman),yes
https://www.youtube.com/watch?v=oNm2B1xTT78,news & politics,Pakistani PM is just another normal citizen for Putin.,Individual (Imran Khan),yes
https://www.youtube.com/watch?v=oNm2B1xTT78,news & politics,Modi is tea seller and indian is happy with that because your media mind wash you no sense of thinking.,Community (Indians),yes
https://www.youtube.com/watch?v=oNm2B1xTT78,news & politics,And modi is not a common person for putin he is a cheap tea seller,Individual (Narender Modi),yes
https://www.youtube.com/watch?v=oNm2B1xTT78,news & politics,Imran Khan has shown insensitivity towards humanity. Man with poor power of reasoning,Individual (Imran Khan),yes
https://www.youtube.com/watch?v=oNm2B1xTT78,news & politics,Imran and Pakistan got another door to beg and riggle for funds. All doors are visited so far. For him this is a new beggar's paradise,Location (Pakistan),yes
https://www.youtube.com/watch?v=xz1nM19gjQ4&ab_channel=JimmyKimmelLive,entertainment,Shame on you and your show.,Individual (Jimmy Kimmel),yes
https://www.youtube.com/watch?v=xz1nM19gjQ4&ab_channel=JimmyKimmelLive,entertainment,"If Trump was in power Kimmel would be all around him about his bad decisions and stuff but now its all about laughs and pranks,, gedadahere",Individual (Jimmy Kimmel),yes
https://www.youtube.com/watch?v=xz1nM19gjQ4&ab_channel=JimmyKimmelLive,entertainment,This. Was. Cringe,Organisation (Jimmy Kimmel live),yes
https://www.youtube.com/watch?v=xz1nM19gjQ4&ab_channel=JimmyKimmelLive,entertainment,Jimmy how about you start writing real jokes instead of making fun of regular people,Individual (Jimmy Kimmel),yes
https://www.youtube.com/watch?v=xz1nM19gjQ4&ab_channel=JimmyKimmelLive,entertainment,Such an insensitive video. atrocious.,Individual (Jimmy Kimmel),yes
https://www.youtube.com/watch?v=xz1nM19gjQ4&ab_channel=JimmyKimmelLive,entertainment,There are things you can do to make Ukrainian people less heard in these moments and one is being Jimmy Kimmel,Individual (Jimmy Kimmel),yes
https://www.youtube.com/watch?v=xz1nM19gjQ4&ab_channel=JimmyKimmelLive,entertainment,With world war worldle people just don't want to correct him because they feel bad. Like how you don't correct a child.,Individual (Jimmy Kimmel),yes
https://www.youtube.com/watch?v=xz1nM19gjQ4&ab_channel=JimmyKimmelLive,entertainment,"Dude's not wrong.. I'm sure Kanye would support it. And the question would make PERFECT sense to him, too.",Individual (Kanye West),yes
https://www.youtube.com/watch?v=xz1nM19gjQ4&ab_channel=JimmyKimmelLive,entertainment,It's funny but sad. It's like America deserves to lose through sheer stupidity.,Community (Americans),yes
https://www.youtube.com/watch?v=xz1nM19gjQ4&ab_channel=JimmyKimmelLive,entertainment,This is where USA really shines. People can just stay out of this political nonsense and choose to be ignorant.,Community (Americans),yes
https://www.youtube.com/watch?v=Fewied9r3sM&ab_channel=JimmyKimmelLive,entertainment,This is beyond cringe,Organisation (Jimmy Kimmel live),yes
https://www.youtube.com/watch?v=Fewied9r3sM&ab_channel=JimmyKimmelLive,entertainment,Waited to do this when you can’t see dislikes huh? Get some nerves to do this when people has say on what you post? Couldn't handle the pressure huh? Cry baby,Organisation (Jimmy Kimmel live),yes
https://www.youtube.com/watch?v=Fewied9r3sM&ab_channel=JimmyKimmelLive,entertainment,What does this do for the black community? View hungry people feeding on a real issue. This is what entertainment industry has become.,Organisation (Entertainment industry),yes
https://www.youtube.com/watch?v=Fewied9r3sM&ab_channel=JimmyKimmelLive,entertainment,Cameron friend is caked up and I want to be able to call her my friend as well.,Individual,yes
https://www.youtube.com/watch?v=Fewied9r3sM&ab_channel=JimmyKimmelLive,entertainment,He isn't doing this to be progressive he's doing it for clicks,Organisation (Jimmy Kimmel live),yes
https://www.youtube.com/watch?v=Fewied9r3sM&ab_channel=JimmyKimmelLive,entertainment,Only the United States make such a big deal of this topics...,Location (USA),yes
https://www.youtube.com/watch?v=PA21Bok59rQ,entertainment,"respect to the man, but the chinese have surely invaded the US",Community (Chinese),yes
https://www.youtube.com/watch?v=PA21Bok59rQ,entertainment,I dont still think they have enough money for proper visual effects in movies,Location (China),yes
https://www.youtube.com/watch?v=PA21Bok59rQ,entertainment,"How did CCP let this legend go international, aren't they too oppresive and locked up? But anyways thanks for this",Organisation (China Communist Party),yes
https://www.youtube.com/watch?v=yj46BWpxFcA,entertainment,meanwhile PE teachers in the states are rude lazy and middle aged americans,Community (US PE Teachers),yes
https://www.youtube.com/watch?v=yj46BWpxFcA,entertainment,And like every PE teacher in England... he’s Australian 😂,"Community (England PE Teachers), Community (Australians)",yes
https://www.youtube.com/watch?v=yj46BWpxFcA,entertainment,this feels scripted,Individual,yes
https://www.youtube.com/watch?v=yj46BWpxFcA,entertainment,look at the other flock of insects constantly buzzing to seek attention and get headlines,Community (Journalists),yes
https://www.youtube.com/watch?v=yj46BWpxFcA,entertainment,That dude has not aged well,Individual,yes
https://www.youtube.com/watch?v=i3AxNmiZapA&ab_channel=JimmyKimmelLive,entertainment,Soon you will see this washed up actor & failed politician performing in Tide commercials.,Individual (Arnold Schwarzenegger),yes
https://www.youtube.com/watch?v=i3AxNmiZapA&ab_channel=JimmyKimmelLive,entertainment,"Ah, yes -- believe our research because we are talking heads on a television, rather than the other talking heads on your phone.",Organisation (Jimmy Kimmel live),yes
https://www.youtube.com/watch?v=i3AxNmiZapA&ab_channel=JimmyKimmelLive,entertainment,You missed the message. You are the type they're making fun of.,Individual,yes
https://www.youtube.com/watch?v=i3AxNmiZapA&ab_channel=JimmyKimmelLive,entertainment,"Ask Arnold Schwarzenegger about health issues.He took so much steriods and anabolics ,he is truly an expert when it comes to pharmacy products.",Individual (Arnold Schwarzenegger),yes
https://www.youtube.com/watch?v=i3AxNmiZapA&ab_channel=JimmyKimmelLive,entertainment,Is this behaviour adverse affects from the vaccine?,"Community (Vaccinators), Community(Scientist)",yes
https://www.youtube.com/watch?v=i3AxNmiZapA&ab_channel=JimmyKimmelLive,entertainment,"Heimlich sued red cross years ago Jimmy, didn't do your research - it's called ""abdominal thrusts"" now. Another failed clip move along",Individual (Jimmy Kimmel),yes
https://www.youtube.com/watch?v=i3AxNmiZapA&ab_channel=JimmyKimmelLive,entertainment,Wow a gas chamber joke? Real smooth jimmy. What's next? A joke on the war in Ukraine? How can a person like you be so famous?,Individual (Jimmy Kimmel),yes
https://www.youtube.com/watch?v=i3AxNmiZapA&ab_channel=JimmyKimmelLive,entertainment,"You gotta get out of there, there is a bom in his belly",Individual (Arnold Schwarzenegger),yes
https://www.youtube.com/watch?v=i3AxNmiZapA&ab_channel=JimmyKimmelLive,entertainment,Late night TV hosts are probably the leading cause of vaccine hesitancy...talking down to people is a great way to push them further away,Community (Late night TV hosts),yes
https://www.youtube.com/watch?v=RKpIh5gI01w&ab_channel=JimmyKimmelLive,entertainment,"This just shows that generally, for men, the purpose of cohabiting with a female is to procreate! Maybe a lot of men will disagree with me and I maybe wrong but truth is when they look at a female, they only look at her in a sexual way but not look at her as a person. I will accept any attacks on my comment from the male point of view but I hope this will lead to a more healthy discussion.",Community (Men),yes
https://www.youtube.com/watch?v=RKpIh5gI01w&ab_channel=JimmyKimmelLive,entertainment,Shows how men treat women pretty clearly.,Community (Men),yes
https://www.youtube.com/watch?v=RKpIh5gI01w&ab_channel=JimmyKimmelLive,entertainment,Never thought I’d see the day when Canadians would be impolite and acting like this. This comment is similar to the right wing trump magazine people on the streets. And mind you I don't keep them in high regard. Such a shame. Canada has been forever tainted.,"Community (Canadians), Location (Canada)",yes
https://www.youtube.com/watch?v=RKpIh5gI01w&ab_channel=JimmyKimmelLive,entertainment,These guys don't deserve a girlfriend. Embarrassing.,Individual (People who apeared in the video),yes
https://www.youtube.com/watch?v=RKpIh5gI01w&ab_channel=JimmyKimmelLive,entertainment,I hope all these woman end these relationships. Shows a complete lack of interest in who the woman are. Not a funny bit at all. Beyond depressing,Individual (People who apeared in the video),yes
https://www.youtube.com/watch?v=RZqbzekVkUI,news & politics,What else do you expect from muslims?,Community (Muslims),yes
https://www.youtube.com/watch?v=RZqbzekVkUI,news & politics,Secularism has lead to the downfall of the country,"Community (Muslims), Location (India)",yes
https://www.youtube.com/watch?v=RZqbzekVkUI,news & politics,0:48 Covid is going on? Complete disregard for the rules by the government to allow this. Shows we need a change,Organisation (Indian Government),yes
https://www.youtube.com/watch?v=RZqbzekVkUI,news & politics,"Why do you even give votes to such low people, they are just ruining the country anyway","Community (Low Caste Indians, Dalits)",yes
https://www.youtube.com/watch?v=RZqbzekVkUI,news & politics,Wasn't the airlines bankrupted? 😂 Who gave such company money?,Organisation (Jet Airways),yes
https://www.youtube.com/watch?v=RZqbzekVkUI,news & politics,"Finally Jet is here, save us from these national tiresome airlines","Organisation (Air India, Other Indian Airlines)",yes
https://www.bitchute.com/video/zh9lybaMVka0/,religion,What nonsense is this? Another propagandist video.,Individual (Content Creator),yes
https://www.bitchute.com/video/zh9lybaMVka0/,religion,"The papacy is, was, and will always be the biblical antichrist of Revelation.",Organisation (Office of pope),yes
https://www.bitchute.com/video/zh9lybaMVka0/,religion,The antipope is not the Antichrist.,Individual (Pope francis),yes
https://www.bitchute.com/video/fkp0fAGrYJSE/,religion,I hope he leaves sooner,Individual (Pope francis),yes
https://www.bitchute.com/video/fkp0fAGrYJSE/,religion,If the people find some old crusty guy stoned and bleeding at comet pizza rhea. We sure gonna have a good idea who might be.,Individual (Pope francis),yes
https://www.bitchute.com/video/fkp0fAGrYJSE/,religion,"When the pope says ""the lord"", he is referring to HIS lord=LUCIFER",Individual (Pope francis),yes
https://www.bitchute.com/video/fkp0fAGrYJSE/,religion,The anti Christ A.I. is coming,Individual (Pope francis),yes
https://www.youtube.com/watch?v=dExrKx7hE6A,health,True virus right here folks,Individual,yes
https://www.youtube.com/watch?v=dExrKx7hE6A,health,The truth will shine it’s brightness through the darkness of your lies…,Organisation (WHO),yes
https://www.youtube.com/watch?v=dExrKx7hE6A,health,How much did you pay this guy?,"Organisation (WHO), Individual",yes
https://www.youtube.com/watch?v=dExrKx7hE6A,health,"Number 1 Killer Virus, but number 2 is still the people there",Location (Africa),yes
https://www.youtube.com/watch?v=PbEodgY1gCs,health,Some cultures are just better than others. Seriously,Community (Chinese),yes
https://www.youtube.com/watch?v=PbEodgY1gCs,health,They literally don't care about the other countries.,Location (China),yes
https://www.youtube.com/watch?v=PbEodgY1gCs,health,I wouldn’t call a Dog and exotic Animal. Then again I wouldn’t call it food either,Community (Chinese),yes
https://www.youtube.com/watch?v=PbEodgY1gCs,health,"If my car starts moving, they will eat it smh.",Community (Chinese),yes
https://www.youtube.com/watch?v=PbEodgY1gCs,health,The world should award them with the best virus manufacturing award,Location (China),yes
https://www.youtube.com/watch?v=PbEodgY1gCs,health,🤢🤮why!!!!? Can they just eat rice 🍚 lol,Community (Chinese),yes
https://www.youtube.com/watch?v=VEQaH4LruUo,health,"These are 4 minutes of my life i would never get back. Just search the definition online, rest nobody knows anyways. Why are people watching this??","Organisation (TED-X), Community (Viewers)",yes
https://www.youtube.com/watch?v=VEQaH4LruUo,health,They had 1 job and screwed that upto to 🤦,Organisation (TED-X),yes
https://www.youtube.com/watch?v=VEQaH4LruUo,health,The only metric unit (and sensible unit) the US uses,Location (USA),yes
https://www.youtube.com/watch?v=VEQaH4LruUo,health,This dudes name is Emma? 🤣😂🤣😂,Individual,yes
https://www.youtube.com/watch?v=VEQaH4LruUo,health,"The dude looks like a lemon, excellent animation TED-X. Atleast do that properly",Organisation (TED-X),yes
https://www.youtube.com/watch?v=VEQaH4LruUo,health,people who cant burn calorie fast enough are disliking this video,Community (Fat People),yes
https://www.youtube.com/watch?v=g7LQS84IL4U,entertainment,Wonder if Pandas are exotic animals too 😋?,Community (Chinese),yes
https://www.youtube.com/watch?v=g7LQS84IL4U,entertainment,"It seems like every chinese knows martial arts, is it a norm?",Community (Chinese),yes
https://www.youtube.com/watch?v=g7LQS84IL4U,entertainment,"Why force them? In the wild there are no medicines, let them be with nature",Individual,yes
https://www.youtube.com/watch?v=g7LQS84IL4U,entertainment,"DONT HURT THEM, one of them fell also",Individual,yes
https://www.youtube.com/watch?v=wOidhxCDBWk,health,"They never want this to end. This isn't about health, it's about money & compliance",Community (Doctors),yes
https://www.youtube.com/watch?v=wOidhxCDBWk,health,"I'm on my 99th booster, but I think I'll go for the permanent booster IV bag. My doctor recommends it.",Community (Doctors),yes
https://www.youtube.com/watch?v=wOidhxCDBWk,health,Can I start with the fourth booster or do I have to get the first three that didn’t work first?,Community (Doctors),yes
https://www.youtube.com/watch?v=wOidhxCDBWk,health,There's a special place in the devil's home for those pushing this toxic on humanity,Community (Doctors),yes
https://www.youtube.com/watch?v=wOidhxCDBWk,health,"I’m skipping the 4th, and going right straight to the 5th! Love these vaccines!",Community (Doctors),yes
https://www.youtube.com/watch?v=wOidhxCDBWk,health,The fact that these vaccines are coming out quicker than Apple makes new iPhones is kinda concerning,"Community (Doctors), Organisation (Apple)",yes
https://www.youtube.com/watch?v=wOidhxCDBWk,health,do not comply to these illegal mandates!!! It’s time to make a stand people!!!,Community (Doctors),yes
https://www.youtube.com/watch?v=RN81h85V6D4,health,🥱😴,Individual,yes
https://www.youtube.com/watch?v=RN81h85V6D4,health,"the way he says ""fuse"" is too damn funny",Individual,yes
https://www.youtube.com/watch?v=RN81h85V6D4,health,Everything’s a reason to stop drinking and smoking. It worsens all illnesses,"Community (Smokers, Drinkers)",yes
https://www.youtube.com/watch?v=aTzAxu4rz7I,fitness,mmmhhmmm gropage,Individual,yes
https://www.youtube.com/watch?v=aTzAxu4rz7I,fitness,Pls dont joke madam🙏🤣,Individual,yes
https://www.youtube.com/watch?v=NWcIKbWK0Ko,fitness,"Damn, I wouldn't call this a protein shake",Individual (Joe Duff),yes
https://www.youtube.com/watch?v=NWcIKbWK0Ko,fitness,This guy is so extra,Individual (Joe Duff),yes
https://www.youtube.com/watch?v=NWcIKbWK0Ko,fitness,Protein shake. More like mass gainer,Individual (Joe Duff),yes
https://www.youtube.com/watch?v=NWcIKbWK0Ko,fitness,"No Thank you , Way too many calories and carbs",Individual (Joe Duff),yes
https://www.youtube.com/watch?v=NWcIKbWK0Ko,fitness,Ain ingredient : cocaine 😂😂,Individual (Joe Duff),yes
