url,category,comment,hate_towards_whom,label
https://www.youtube.com/watch?v=P596EkLY_9U,religion,"Indian monk am a new subscriber of your channel, am loved in your informative video’s. May I request to you give English subtitle I’m your upcoming precious videos . It’s my humble request 🙏🙏🙏",None,no
https://www.youtube.com/watch?v=P596EkLY_9U,religion,"Indian monk am a new subscriber of your channel, am loved in your informative video’s. May I request to you give English subtitle I’m your upcoming precious videos . It’s my humble request 🙏🙏🙏",None,no
https://www.youtube.com/watch?v=P596EkLY_9U,religion,Doing a great work when we are taught in school about mughals rather than teaching rich heritage of our country thanks alot 🙏,None,no
https://www.youtube.com/watch?v=P596EkLY_9U,religion,Doing a great work when we are taught in school about mughals rather than teaching rich heritage of our country thanks alot 🙏,None,no
https://www.youtube.com/watch?v=LDQ0w_f5P2s,religion,"The parable of the jar is the crown jewel of the gospel of Thomas. Enigmatic and impactful, with an intuitive message that defies direct explaination.",None,no
https://www.youtube.com/watch?v=LDQ0w_f5P2s,religion,it is the crown jewel of the gospel of thomas - enigmatic and impactful with an intuitive message that defies direct explanation - ,None,no
https://www.youtube.com/watch?v=LDQ0w_f5P2s,religion,it is the crown jewel of the gospel of thomas - enigmatic and impactful with an intuitive message that defies direct explanation,None,no
https://www.youtube.com/watch?v=LDQ0w_f5P2s,religion,it is the crown jewel of the gospel of thomas - enigmatic and impactful with an intuitive message that defies direct explanations,None,no
https://www.youtube.com/watch?v=LDQ0w_f5P2s,religion,What's really fascinating is that copies of the Gospel of Thomas are almost always found with copies of the Gospel of Jerry.,None,no
https://www.youtube.com/watch?v=LDQ0w_f5P2s,religion,and what's really fascinating is that copies of the gospel of thomas are almost always found alongside copies of the gospel of jerry,None,no
https://www.youtube.com/watch?v=LDQ0w_f5P2s,religion,The council of nicea!,None,no
https://www.youtube.com/watch?v=LDQ0w_f5P2s,religion,the council of nicea,None,no
https://www.youtube.com/watch?v=LDQ0w_f5P2s,religion,There are two constants that I see in all the gospels and teachings of and about Jesus that is to love and to look inside yourself for truth. I'm sure all the gospels contain some truth but the fact they have been retranslated several times and written by man which only means that there are most likely some imperfections. I have gotten closer to god now that i have learned to look within.,None,no
https://www.youtube.com/watch?v=LDQ0w_f5P2s,religion,one constant i see in all the gospels and teachings of and about jesus is to love and look inside yourself for truth i'm sure all the gospels contain some truth but the fact that they have been retranslated several times and written by man only means that there are most likely some imperfections,None,no
https://www.youtube.com/watch?v=LDQ0w_f5P2s,religion,one constant i see in all the gospels and teachings of and about jesus is to love and look inside yourself for truth i'm sure all the gospels contain some truth but the fact they have been retranslated several times and written by man only means that there are most likely some imperfections,None,no
https://www.youtube.com/watch?v=LDQ0w_f5P2s,religion,"Hi I just tripped over your channel, and I subscribed. Really enjoyed the video. Sheer Awesomesauce.",None,no
https://www.youtube.com/watch?v=LDQ0w_f5P2s,religion,"Hi I just tripped over your channel, and I subscribed. Really enjoyed the video. Sheer Awesomesauce.",None,no
https://www.youtube.com/watch?v=fDG5U0inNlE,religion,"With Paul, you're all welcome 👍",None,no
https://www.youtube.com/watch?v=fDG5U0inNlE,religion,with paul you are all welcome,None,no
https://www.youtube.com/watch?v=0twopr59buc,religion,"Excellent! love it! Perfect for my teaching purposes. I will be sure to add this to my own course resources for my students. Point seems to be to not use the term ""cult"" in the negative context that the media tends to use it. such use confuses and misleads the common man when they then hear academics use the term in the academic context. Just one question, what sort of term would you use for groups like Jim Jones' People's Temple (""bad religion"")? Or Charles manson's ""The Family""?",None,no
https://www.youtube.com/watch?v=0twopr59buc,religion,"Excellent! love it! Perfect for my teaching purposes. I will be sure to add this to my own course resources for my students. Point seems to be to not use the term ""cult"" in the negative context that the media tends to use it. such use confuses and misleads the common man when they then hear academics use the term in the academic context. Just one question, what sort of term would you use for groups like Jim Jones' People's Temple (""bad religion"")? Or Charles manson's ""The Family""?",None,no
https://www.youtube.com/watch?v=KLkcS-YhY0U,cuisine,I had a request! Can papa Sal teach us how to prep/can tomatoes? I am growing san matízano tomatoes this year to make amazing sauces From scratch ❤️,None,no
https://www.youtube.com/watch?v=KLkcS-YhY0U,cuisine,my request was can papa sal teach us how to preparecan tomatoes? i'm growing san matzano tomatoes this year to make amazing sauces from scratch,None,no
https://www.youtube.com/watch?v=KLkcS-YhY0U,cuisine,my request was can papa sal teach us how to preparecan tomatoes? i am growing san matzano tomatoes this year to make amazing sauces from scratch -,None,no
https://www.youtube.com/watch?v=KLkcS-YhY0U,cuisine,my request was can papa sal teach us how to preparecan tomatoes? i am growing san matzano tomatoes this year to make amazing sauces from scratch,None,no
https://www.youtube.com/watch?v=KLkcS-YhY0U,cuisine,my request was can papa sal teach us how to preparecan tomatoes? i am growing san matzano tomatoes this year to make amazing sauces from scratch ,None,no
https://www.youtube.com/watch?v=KLkcS-YhY0U,cuisine,my request is can papa sal teach us how to preparecan tomatoes? i am growing san matzano tomatoes this year to make amazing sauces from scratch,None,no
https://www.youtube.com/watch?v=KLkcS-YhY0U,cuisine,my request is can papa sal teach us how to preparecan tomatoes? i am growing san matzano tomatoes this year to make amazing sauces from scratch ,None,no
https://www.youtube.com/watch?v=KLkcS-YhY0U,cuisine,I need to make this ASAP! Looks absolutely delicious! ☺️,None,no
https://www.youtube.com/watch?v=KLkcS-YhY0U,cuisine,i have to make this asap,None,no
https://www.youtube.com/watch?v=r8HuSkD0Nms,cuisine,"Throwing away bacon fat is almost sacrilegious😳😳😳😳 you can save it and use it for so many other things, like frying eggs or just adding a teaspoon in your soup and many more . This is one of my favorite meals, my daughter is the Guiness stew cook in my house , she has really perfected it🥰 Maybe I’ll ask her to make it for my birthday on the 28th😂 Her birthday is the 26th, so if I make her Favorit meal maybe she’ll make mine😄",None,no
https://www.youtube.com/watch?v=r8HuSkD0Nms,cuisine,"Throwing away bacon fat is almost sacrilegious😳😳😳😳 you can save it and use it for so many other things, like frying eggs or just adding a teaspoon in your soup and many more . This is one of my favorite meals, my daughter is the Guiness stew cook in my house , she has really perfected it🥰 Maybe I’ll ask her to make it for my birthday on the 28th😂 Her birthday is the 26th, so if I make her Favorit meal maybe she’ll make mine😄",None,no
https://www.youtube.com/watch?v=A-wE-fb_w68,cuisine,"Irish grandmother. Cabbage and scallions, lots of butter. Never tried kale. Looks great not made in years, bring back memories. She died 1984.",None,no
https://www.youtube.com/watch?v=A-wE-fb_w68,cuisine,"Irish grandmother. Cabbage and scallions, lots of butter. Never tried kale. Looks great not made in years, bring back memories. She died 1984.",None,no
https://www.youtube.com/watch?v=RWycD2yd0zE,cuisine,"☘️ 💚🍀”Top of the afternoon ta ya”; with our St. Patty’s Day just around the corner, this is a great version of the famous ☘️Irish Potato pancakes; Irish or Not? What is politically correct is to use the full Name and not slang; “☘️ St. Patrick’s Day”.",None,no
https://www.youtube.com/watch?v=RWycD2yd0zE,cuisine,"☘️ 💚🍀”Top of the afternoon ta ya”; with our St. Patty’s Day just around the corner, this is a great version of the famous ☘️Irish Potato pancakes; Irish or Not? What is politically correct is to use the full Name and not slang; “☘️ St. Patrick’s Day”.",None,no
https://www.youtube.com/watch?v=YuL_OLWMd_U,cuisine,"Okay first time I made this, it came out perfect. 2nd time I made this, it went flat and my dough is kinda wet? I followed everything though except for shortening.",None,no
https://www.youtube.com/watch?v=YuL_OLWMd_U,cuisine,"Okay first time I made this, it came out perfect. 2nd time I made this, it went flat and my dough is kinda wet? I followed everything though except for shortening.",None,no
https://www.youtube.com/watch?v=YuL_OLWMd_U,cuisine,3:38 that's what she said! winning! lol. those cookies do look good though.,None,no
https://www.youtube.com/watch?v=YuL_OLWMd_U,cuisine,lol 338 that's what she said about winning,None,no
https://www.youtube.com/watch?v=YuL_OLWMd_U,cuisine,338 that's what she said about winning lol,None,no
https://www.youtube.com/watch?v=wAtvknk2xrQ,cuisine,Wonderful recipe 😍 but can you write ingredients in grams?) for russian followers 🥺,None,no
https://www.youtube.com/watch?v=wAtvknk2xrQ,cuisine,Wonderful recipe 😍 but can you write ingredients in grams?) for russian followers 🥺,None,no
https://www.youtube.com/watch?v=4rZuPPFmDDk,cuisine,"You really never disappoint us, I really appreciate your effort and dedication to make interesting food videos for us just amazing 👍",None,no
https://www.youtube.com/watch?v=4rZuPPFmDDk,cuisine,"You really never disappoint us, I really appreciate your effort and dedication to make interesting food videos for us just amazing 👍",None,no
https://www.youtube.com/watch?v=JtpnjfDw8Kc,cuisine,"I feel like if you put the same stuff in the store bought tortilla with pre shredded cheese, it would be pretty similar and less hassle of having to make your own tortillas and shred your own cheese. But yes, homemade looks absolutely amazing",None,no
https://www.youtube.com/watch?v=JtpnjfDw8Kc,cuisine,"I feel like if you put the same stuff in the store bought tortilla with pre shredded cheese, it would be pretty similar and less hassle of having to make your own tortillas and shred your own cheese. But yes, homemade looks absolutely amazing",None,no
https://www.youtube.com/watch?v=EApkyOBewEw,cuisine,"OMG u r even more Chinese than me in some way lmao…i love eat hot pot with my friends but i never made the base soup by myself, but i make tomato base sometimes, its easier and we can drink",None,no
https://www.youtube.com/watch?v=EApkyOBewEw,cuisine,"OMG u r even more Chinese than me in some way lmao…i love eat hot pot with my friends but i never made the base soup by myself, but i make tomato base sometimes, its easier and we can drink",None,no
https://www.youtube.com/watch?v=EApkyOBewEw,cuisine,"Argh, as I was saying to myself one year ago, you'll be speaking french in no time if you keep using french words haha ! But this time it's not ""accoutrement"" (that means outfit, clothes) but ""accompagnement"" (sides for dishes). Keep the good work ! You rock ! And your ""oignon"" is impeccable, always make me giggle !",None,no
https://www.youtube.com/watch?v=EApkyOBewEw,cuisine,"Argh, as I was saying to myself one year ago, you'll be speaking french in no time if you keep using french words haha ! But this time it's not ""accoutrement"" (that means outfit, clothes) but ""accompagnement"" (sides for dishes). Keep the good work ! You rock ! And your ""oignon"" is impeccable, always make me giggle !",None,no
https://www.youtube.com/watch?v=EApkyOBewEw,cuisine,Josh is everyone’s favorite uncle when it comes to cooking!,None,no
https://www.youtube.com/watch?v=EApkyOBewEw,cuisine,josh is everyone's favorite uncle when it comes to food,None,no
https://www.youtube.com/watch?v=EApkyOBewEw,cuisine,josh is everybody's favorite uncle when it comes to cooking,None,no
https://www.youtube.com/watch?v=EApkyOBewEw,cuisine,josh is everyone's favourite uncle when it comes to cooking,None,no
https://www.youtube.com/watch?v=EApkyOBewEw,cuisine,josh is everyone's favorite uncle when it comes to cooking,None,no
https://www.youtube.com/watch?v=mrDJ2K3JXsA,cuisine,As a brown girl who loves to cook. I'd recommend adding dried fenugreek leaves when you're simmering the chicken and the sauce. It really oumphs up the flavor.,None,no
https://www.youtube.com/watch?v=mrDJ2K3JXsA,cuisine,as a brown girl who loves to cook i'd recommend adding dried fenugreek leaves when you're simmering the chicken and the sauce,None,no
https://www.youtube.com/watch?v=mrDJ2K3JXsA,cuisine,"I remember seeing a comment that said it would be nice seeing your techniques for how to make things faster, and it’s nice to see that you included some tips this time! Though I’m still pretty sure I would make this much slower, but thanks for listening to your audience Josh :)",None,no
https://www.youtube.com/watch?v=mrDJ2K3JXsA,cuisine,"I remember seeing a comment that said it would be nice seeing your techniques for how to make things faster, and it’s nice to see that you included some tips this time! Though I’m still pretty sure I would make this much slower, but thanks for listening to your audience Josh :)",None,no
https://www.youtube.com/watch?v=UeDMZIB8dg8,cuisine,Hey man love everything you make on this channel food looks amazing every time but… **cost of oil not included** It does mention that you use the oil that you used for the chicken to also fry the curly fries but no cost. Great Value Veg Oil(Walmart):$2.98 for 48oz Video says use 4 quarts 2.6667 bottles 2.6667 x $2.98= $7.946 $7.95 + $1.78(price listed in recipe)= $9.73 That’s every time you make it and actually almost $3 more than you said it cost to go order it somewhere. Not hate just saying might want to include that.,None,no
https://www.youtube.com/watch?v=UeDMZIB8dg8,cuisine,Hey man love everything you make on this channel food looks amazing every time but… **cost of oil not included** It does mention that you use the oil that you used for the chicken to also fry the curly fries but no cost. Great Value Veg Oil(Walmart):$2.98 for 48oz Video says use 4 quarts 2.6667 bottles 2.6667 x $2.98= $7.946 $7.95 + $1.78(price listed in recipe)= $9.73 That’s every time you make it and actually almost $3 more than you said it cost to go order it somewhere. Not hate just saying might want to include that.,None,no
https://www.youtube.com/watch?v=UeDMZIB8dg8,cuisine,This looks to be also a somewhat but better on raisin cane's,None,no
https://www.youtube.com/watch?v=UeDMZIB8dg8,cuisine,This looks to be also a somewhat but better on raisin cane's,None,no
https://www.youtube.com/watch?v=UeDMZIB8dg8,cuisine,"I haven’t even watched 1 minute yet but the thumbnail looks so freaking good. I will definitely make these to the best of my ability, papa.",None,no
https://www.youtube.com/watch?v=UeDMZIB8dg8,cuisine,i haven't even watched 1 minute yet but the thumbnail looks so good i'll definitely make these to the best of my ability papa,None,no
https://www.youtube.com/watch?v=kSa6n-b7d8o,cuisine,500$ is at a high end restaurant. You can buy it and make it at home for much less. Definitely a special occasion dish but people should’t be scared to try it!,None,no
https://www.youtube.com/watch?v=kSa6n-b7d8o,cuisine,500$ is at a high end restaurant. You can buy it and make it at home for much less. Definitely a special occasion dish but people should’t be scared to try it!,None,no
https://www.youtube.com/watch?v=kSa6n-b7d8o,cuisine,"Look, I love to cook & love a well cooked meal. But watching a master in their craft is always a treat, no matter what it is. I’ll never be at Gordon’s level, but it’s so satisfying to watch.",None,no
https://www.youtube.com/watch?v=kSa6n-b7d8o,cuisine,"Look, I love to cook & love a well cooked meal. But watching a master in their craft is always a treat, no matter what it is. I’ll never be at Gordon’s level, but it’s so satisfying to watch.",None,no
https://www.youtube.com/watch?v=zit9l5jtbws,cuisine,"Gordon in the shower: “Just a dab of soap, a drizzle of water, and a splash, just a splash, of conditioner. And that’s how you make the most delicious, tender hair in the world.”",None,no
https://www.youtube.com/watch?v=zit9l5jtbws,cuisine,how do you make the most tender hair?,None,no
https://www.youtube.com/watch?v=zit9l5jtbws,cuisine,I totally agree with the method of using Yukon gold potatoes for the chips first cooked at a lower temperature and then cranking up the heat. When I was a kid making fries I tried to share this technique with my Dad but he wouldn't listen but I am the Queen a great fries. The fish Gordon did was excellent. I just wouldn't mash u those peas. I also find butter too rich so I would just use a touch of olive oil. I definitely would put lemon on my fish but hold the tartar sauce.,None,no
https://www.youtube.com/watch?v=zit9l5jtbws,cuisine,I totally agree with the method of using Yukon gold potatoes for the chips first cooked at a lower temperature and then cranking up the heat. When I was a kid making fries I tried to share this technique with my Dad but he wouldn't listen but I am the Queen a great fries. The fish Gordon did was excellent. I just wouldn't mash u those peas. I also find butter too rich so I would just use a touch of olive oil. I definitely would put lemon on my fish but hold the tartar sauce.,None,no
https://www.youtube.com/watch?v=zit9l5jtbws,cuisine,I want one Pls! !,None,no
https://www.youtube.com/watch?v=zit9l5jtbws,cuisine,I want one Pls! !,None,no
https://www.youtube.com/watch?v=zit9l5jtbws,cuisine,Fuckin amazing,None,no
https://www.youtube.com/watch?v=zit9l5jtbws,cuisine,Fuckin amazing,None,no
https://www.youtube.com/watch?v=zit9l5jtbws,cuisine,The best guy with the best food with the best skills,None,no
https://www.youtube.com/watch?v=ds5MbgbXLBo,cuisine,Ah watching Gordon cooking is like a brain massage,None,no
https://www.youtube.com/watch?v=ds5MbgbXLBo,cuisine,Ah watching Gordon cooking is like a brain massage,None,no
https://www.youtube.com/watch?v=Q2QCvORjBYk,cuisine,im proud being called asian because we have japan.. although im not japanese 😁,None,no
https://www.youtube.com/watch?v=Q2QCvORjBYk,cuisine,im proud being called asian because we have japan.. although im not japanese 😁,None,no
https://www.youtube.com/watch?v=86idhCsmZto,cuisine,"“After that I take my chop-chop,” *I will die for this man any day.* Edit: Omg thx for all the likes!",None,no
https://www.youtube.com/watch?v=86idhCsmZto,cuisine,This shit was cute and that smile deserves to be protected.,None,no
https://www.youtube.com/watch?v=86idhCsmZto,cuisine,Yo it looks just like Indonesian *EGG MARTABAK* 👌👌👌 The taste is superb! That dish is on the pinnacle of late night craving dish 😂,None,no
https://www.youtube.com/watch?v=86idhCsmZto,cuisine,Yo it looks just like Indonesian *EGG MARTABAK* 👌👌👌 The taste is superb! That dish is on the pinnacle of late night craving dish 😂,None,no
https://www.youtube.com/watch?v=bOsk1Io1qYY,cuisine,Wow❤️👍🏻❤️👍🏻👍🏻❤️,None,no
https://www.youtube.com/watch?v=bOsk1Io1qYY,cuisine,Wow❤️👍🏻❤️👍🏻👍🏻❤️,None,no
https://www.youtube.com/watch?v=bOsk1Io1qYY,cuisine,All pani is very amazing ❤️❤️❤️🇪🇹 💚💛❤️,None,no
https://www.youtube.com/watch?v=bOsk1Io1qYY,cuisine,So many flavours ...I came to know first time... Delicious 😋,None,no
https://www.youtube.com/watch?v=bOsk1Io1qYY,cuisine,So many flavours ...I came to know first time... Delicious 😋,None,no
https://www.youtube.com/watch?v=bOsk1Io1qYY,cuisine,Will surely try this. Good summer snack. Thanks for sharing. God bless you.,None,no
https://www.youtube.com/watch?v=bOsk1Io1qYY,cuisine,thank you for sharing,None,no
https://www.youtube.com/watch?v=bOsk1Io1qYY,cuisine,this is a good summer snack thanks for sharing,None,no
https://www.youtube.com/watch?v=bOsk1Io1qYY,cuisine,i'll certainly try this good summer snack thanks for sharing,None,no
https://www.youtube.com/watch?v=bOsk1Io1qYY,cuisine,i'll definitely try this good summer snack thanks for sharing,None,no
https://www.youtube.com/watch?v=bOsk1Io1qYY,cuisine,i'll surely try this good summer snack thanks for sharing,None,no
https://www.youtube.com/watch?v=bOsk1Io1qYY,cuisine,6 flavors... never imagined... u r great....,None,no
https://www.youtube.com/watch?v=bOsk1Io1qYY,cuisine,6 flavors... never imagined... u r great....,None,no
https://www.youtube.com/watch?v=bOsk1Io1qYY,cuisine,ONE and only hebbars kitchen recipe must easy and yummy,None,no
https://www.youtube.com/watch?v=bOsk1Io1qYY,cuisine,ONE and only hebbars kitchen recipe must easy and yummy,None,no
https://www.youtube.com/watch?v=bOsk1Io1qYY,cuisine,All pani is very amazing 🤤👌🙂,None,no
https://www.youtube.com/watch?v=bOsk1Io1qYY,cuisine,Thanku for recipe mam ...🤩we are trying it now mam ...❤️✨,None,no
https://www.youtube.com/watch?v=bOsk1Io1qYY,cuisine,Thanku for recipe mam ...🤩we are trying it now mam ...❤️✨,None,no
https://www.youtube.com/watch?v=bOsk1Io1qYY,cuisine,🙏💯😊,None,no
https://www.youtube.com/watch?v=bOsk1Io1qYY,cuisine,First like n comment 💞💞,None,no
https://www.youtube.com/watch?v=bOsk1Io1qYY,cuisine,First like n comment 💞💞,None,no
https://www.youtube.com/watch?v=4Xk4Qj1x9Fs,entertainment,Aww loved that she actually played the game! Sometimes you can tell they don’t want to say lol,None,no
https://www.youtube.com/watch?v=4Xk4Qj1x9Fs,entertainment,Aww loved that she actually played the game! Sometimes you can tell they don’t want to say lol,None,no
https://www.youtube.com/watch?v=zR9J4F7nAEI,entertainment,"Don’t give up there’s great men out there!! Like Steve says look your best everyday!! Wear makeup, do your nails and look your best!! He’s out there, and don’t settle for less!! You deserve to be a wife!! Also, get your ring size so you can prepare for that wedding ring for your future husband!! 💍💍💍 😉😉😉",None,no
https://www.youtube.com/watch?v=zR9J4F7nAEI,entertainment,"""If you want more people to shake your hand, you've to extend your hand"" nice one Mr Steve 😂",None,no
https://www.youtube.com/watch?v=zR9J4F7nAEI,entertainment,"""If you want more people to shake your hand, you've to extend your hand"" nice one Mr Steve 😂",None,no
https://www.youtube.com/watch?v=yB7H3odA0zI,entertainment,Hey Steve she's single I'm single lol ....she's beautiful tho 🌻🌻,None,no
https://www.youtube.com/watch?v=yB7H3odA0zI,entertainment,Hey Steve she's single I'm single lol ....she's beautiful tho 🌻🌻,None,no
https://www.youtube.com/watch?v=aSEna5vubto,entertainment,"Steve, somehow you have been given a touch of King Solomon! You have been blessed! : )",None,no
https://www.youtube.com/watch?v=aSEna5vubto,entertainment,"Steve, somehow you have been given a touch of King Solomon! You have been blessed! : )",None,no
https://www.youtube.com/watch?v=dw3-k95QkDw,entertainment,This guy just raised the bar for young artists,None,no
https://www.youtube.com/watch?v=dw3-k95QkDw,entertainment,he raised the bar for young artists,None,no
https://www.youtube.com/watch?v=dw3-k95QkDw,entertainment,he just raised the bar for young artists,None,no
https://www.youtube.com/watch?v=dw3-k95QkDw,entertainment,this guy raised the bar for young artists,None,no
https://www.youtube.com/watch?v=dw3-k95QkDw,entertainment,this guy has raised the bar for young artists,None,no
https://www.youtube.com/watch?v=dw3-k95QkDw,entertainment,and this guy has raised the bar for young artists,None,no
https://www.youtube.com/watch?v=dw3-k95QkDw,entertainment,this guy just raised the bar for young artists,None,no
https://www.youtube.com/watch?v=dw3-k95QkDw,entertainment,and this guy just raised the bar for young artists,None,no
https://www.youtube.com/watch?v=dw3-k95QkDw,entertainment,He is weirdly awesome man!!,None,no
https://www.youtube.com/watch?v=dw3-k95QkDw,entertainment,a weirdly awesome person,None,no
https://www.youtube.com/watch?v=dw3-k95QkDw,entertainment,Charlie is my fav artist all time😭❤️,None,no
https://www.youtube.com/watch?v=dw3-k95QkDw,entertainment,charlie my favorite artist,None,no
https://www.youtube.com/watch?v=dw3-k95QkDw,entertainment,charlie my favorite artist of all time,None,no
https://www.youtube.com/watch?v=dw3-k95QkDw,entertainment,It’s fascinating how his brain works 🤯,None,no
https://www.youtube.com/watch?v=dw3-k95QkDw,entertainment,how does his brain work?,None,no
https://www.youtube.com/watch?v=dw3-k95QkDw,entertainment,how does his brain works?,None,no
https://www.youtube.com/watch?v=dw3-k95QkDw,entertainment,I'm 26 I'm playing keyboard from 8 years can i develop perfect pitch 😭😭😰😰🙏🙏,None,no
https://www.youtube.com/watch?v=dw3-k95QkDw,entertainment,can i develop perfect pitch?,None,no
https://www.youtube.com/watch?v=dw3-k95QkDw,entertainment,He has tons of tons of knowledge in music !,None,no
https://www.youtube.com/watch?v=dw3-k95QkDw,entertainment,and he's got tons of knowledge in music,None,no
