url,category,comment,hate_towards_whom,label
https://www.youtube.com/watch?v=8CUUFpRYtN4,fashion & beauty,i love how she talks about her bullies and then tells us she's wearing a gucci lip product,None,no
https://www.youtube.com/watch?v=8CUUFpRYtN4,fashion & beauty,To the person reading this: god has a plan; trust the process 🤍,None,no
https://www.youtube.com/watch?v=8CUUFpRYtN4,fashion & beauty,To the person reading this: god has a plan; trust the process 🤍,None,no
https://www.youtube.com/watch?v=8CUUFpRYtN4,fashion & beauty,She's prettier without anything on her face 😫💗 Sana ol.,None,no
https://www.youtube.com/watch?v=8CUUFpRYtN4,fashion & beauty,She's prettier without anything on her face 😫💗 Sana ol.,None,no
https://www.youtube.com/watch?v=8CUUFpRYtN4,fashion & beauty,"Honestly, can we just appreciate the fact that Filipino celebs are slaying rn? Like Bella, Bretman and even Olivia Rodrigo who is half!",None,no
https://www.youtube.com/watch?v=8CUUFpRYtN4,fashion & beauty,"Honestly, can we just appreciate the fact that Filipino celebs are slaying rn? Like Bella, Bretman and even Olivia Rodrigo who is half!",None,no
https://www.youtube.com/watch?v=8CUUFpRYtN4,fashion & beauty,I'm Indonesian and my upper lip is also darker. I think that's southeast asian thing :'),None,no
https://www.youtube.com/watch?v=8CUUFpRYtN4,fashion & beauty,I'm Indonesian and my upper lip is also darker. I think that's southeast asian thing :'),None,no
https://www.youtube.com/watch?v=8CUUFpRYtN4,fashion & beauty,I love how she mention her past about bully and can't afford stuff and how she is grateful now that she became successful and advice us to never give up.,None,no
https://www.youtube.com/watch?v=8CUUFpRYtN4,fashion & beauty,I love how she mention her past about bully and can't afford stuff and how she is grateful now that she became successful and advice us to never give up.,None,no
https://www.youtube.com/watch?v=HtF-UWOwges,fashion & beauty,Her foundation skills is my goals😂,None,no
https://www.youtube.com/watch?v=HtF-UWOwges,fashion & beauty,her skills are my goals,None,no
https://www.youtube.com/watch?v=HtF-UWOwges,fashion & beauty,her foundation skills is one of my goals,None,no
https://www.youtube.com/watch?v=4MVHi96NZls,fashion & beauty,this woman makes me comfortable with being a tomboy. cool girl,None,no
https://www.youtube.com/watch?v=4MVHi96NZls,fashion & beauty,this woman makes me feel like a tomboy,None,no
https://www.youtube.com/watch?v=4MVHi96NZls,fashion & beauty,this woman makes me feel comfortable being a tomboy,None,no
https://www.youtube.com/watch?v=4MVHi96NZls,fashion & beauty,this woman makes me comfortable with being a tomboy,None,no
https://www.youtube.com/watch?v=4MVHi96NZls,fashion & beauty,"Hailey: ""it got that yummy fleece on the inside.. Justin: ""you got that yummy.. yummy..",None,no
https://www.youtube.com/watch?v=4MVHi96NZls,fashion & beauty,"she is the only model who loves super over size, it is a good thing",None,no
https://www.youtube.com/watch?v=4MVHi96NZls,fashion & beauty,"she is the only model who loves super over size, it is a good thing",None,no
https://www.youtube.com/watch?v=4MVHi96NZls,fashion & beauty,Hailey seems like she is actually sincerely genuine and kind to people and not just for show like other celebrities!!,None,no
https://www.youtube.com/watch?v=4MVHi96NZls,fashion & beauty,Hailey seems like she is actually sincerely genuine and kind to people and not just for show like other celebrities!!,None,no
https://www.youtube.com/watch?v=4MVHi96NZls,fashion & beauty,She’s so perfect like she could wear a potato bag and still look stunning,None,no
https://www.youtube.com/watch?v=4MVHi96NZls,fashion & beauty,She’s so perfect like she could wear a potato bag and still look stunning,None,no
https://www.youtube.com/watch?v=4MVHi96NZls,fashion & beauty,"7 days, 7 looks.. so she looks stunning everyday and every night",None,no
https://www.youtube.com/watch?v=4MVHi96NZls,fashion & beauty,"7 days, 7 looks.. so she looks stunning everyday and every night",None,no
https://www.youtube.com/watch?v=4MVHi96NZls,fashion & beauty,I have a good feeling she is pregnant .... please be ......big love,None,no
https://www.youtube.com/watch?v=4MVHi96NZls,fashion & beauty,she literally has the best style !!!,None,no
https://www.youtube.com/watch?v=4MVHi96NZls,fashion & beauty,she has the best style i can imagine,None,no
https://www.youtube.com/watch?v=4MVHi96NZls,fashion & beauty,she has the best style i can think of,None,no
https://www.youtube.com/watch?v=4MVHi96NZls,fashion & beauty,she's got the best style,None,no
https://www.youtube.com/watch?v=4MVHi96NZls,fashion & beauty,she has the best style,None,no
https://www.youtube.com/watch?v=4MVHi96NZls,fashion & beauty,she literally has the best style,None,no
https://www.youtube.com/watch?v=4MVHi96NZls,fashion & beauty,Idc what ppl say I love her,None,no
https://www.youtube.com/watch?v=4MVHi96NZls,fashion & beauty,Idc what ppl say I love her,None,no
https://www.youtube.com/watch?v=hWHG4m16rCM,fashion & beauty,It worked !,None,no
https://www.youtube.com/watch?v=hWHG4m16rCM,fashion & beauty,it worked out,None,no
https://www.youtube.com/watch?v=hWHG4m16rCM,fashion & beauty,"Im definitely going to try this tonight! I'll post updates today and tomorrow and once I'm finished. Edit 1: About to wash my hair and start the process :) Edit 2: Finished combing through my hair/putting it in the ponytail, more updates coming after the hour is done. Edit 3: The hour is over, so now I'm starting to put the bobby pins in place. Edit 4: I put all the bobby pins in and look stupid. Doubting this tutorial now... (next update will be in the morning) Edit 5: It didn't work. My hair just turned out curly like it was before. This was a very good idea, and I might try it again soon! :) Okay so it is about 2 months later (1/17/19) and im willing to try again. - i have already washed and combed my hair and i am now waiting for the hour to finish.",None,no
https://www.youtube.com/watch?v=hWHG4m16rCM,fashion & beauty,"Im definitely going to try this tonight! I'll post updates today and tomorrow and once I'm finished. Edit 1: About to wash my hair and start the process :) Edit 2: Finished combing through my hair/putting it in the ponytail, more updates coming after the hour is done. Edit 3: The hour is over, so now I'm starting to put the bobby pins in place. Edit 4: I put all the bobby pins in and look stupid. Doubting this tutorial now... (next update will be in the morning) Edit 5: It didn't work. My hair just turned out curly like it was before. This was a very good idea, and I might try it again soon! :) Okay so it is about 2 months later (1/17/19) and im willing to try again. - i have already washed and combed my hair and i am now waiting for the hour to finish.",None,no
https://www.youtube.com/watch?v=hWHG4m16rCM,fashion & beauty,she is soo pretty and hair is soo pretty,None,no
https://www.youtube.com/watch?v=hWHG4m16rCM,fashion & beauty,"I have no idea how she wrapped her hair around in the first place! itried it and it does totally work, I love it but it's hard to wrap the hair around your head in the first place",None,no
https://www.youtube.com/watch?v=hWHG4m16rCM,fashion & beauty,"I have no idea how she wrapped her hair around in the first place! itried it and it does totally work, I love it but it's hard to wrap the hair around your head in the first place",None,no
https://www.youtube.com/watch?v=hWHG4m16rCM,fashion & beauty,"I'm trying it right now and I have the exact same hair as Alexandra, so yeah I hope this works",None,no
https://www.youtube.com/watch?v=hWHG4m16rCM,fashion & beauty,and i have exactly the same hair as alexandra so yeah i hope it works,None,no
https://www.youtube.com/watch?v=hWHG4m16rCM,fashion & beauty,and i have exactly the same hair as alexandra so yeah i hope this works,None,no
https://www.youtube.com/watch?v=hWHG4m16rCM,fashion & beauty,and i have the exact same hair as alexandra so yeah i hope this works out,None,no
https://www.youtube.com/watch?v=hWHG4m16rCM,fashion & beauty,OMG THANK U SO MUCH THIA SO HELPFUL MY HAIR IS A LITERAL BALL OF PUFF 😞AND IM NOT ALOUD TO STRENGTHEN MY HAIR THANK U,None,no
https://www.youtube.com/watch?v=hWHG4m16rCM,fashion & beauty,OMG THANK U SO MUCH THIA SO HELPFUL MY HAIR IS A LITERAL BALL OF PUFF 😞AND IM NOT ALOUD TO STRENGTHEN MY HAIR THANK U,None,no
https://www.youtube.com/watch?v=hWHG4m16rCM,fashion & beauty,"I freaking love you! Your videos are soooo helpful, the editing is bomb and obviously you ate bomb! I don't understand how certain people are hating on you... I love you, for real !",None,no
https://www.youtube.com/watch?v=hWHG4m16rCM,fashion & beauty,"I freaking love you! Your videos are soooo helpful, the editing is bomb and obviously you ate bomb! I don't understand how certain people are hating on you... I love you, for real !",None,no
https://www.youtube.com/watch?v=hWHG4m16rCM,fashion & beauty,@AlexandrasGirlyTalk hey i am a girl (don't look at my name it's my dad's profile) emm... Well you are amazing and sooo beautiful ok em my hair are curly and not so long but my problem is that my hair area frizzy and bushy!!! And sometimes they are not even curly plz can you tell me what can i do?,None,no
https://www.youtube.com/watch?v=hWHG4m16rCM,fashion & beauty,@AlexandrasGirlyTalk Alexandra do you recommend spraying hair spray after finishing everything ?? Love you 💕💕,None,no
https://www.youtube.com/watch?v=hWHG4m16rCM,fashion & beauty,@AlexandrasGirlyTalk Alexandra do you recommend spraying hair spray after finishing everything ?? Love you 💕💕,None,no
https://www.youtube.com/watch?v=iMCEgHmK4mg,fashion & beauty,"As I'm getting older, I'm noticing my skin is different so I can't apply make up like I used to. Thanks Vogue and Marisa for sharing a routine that isn't for 20 year skin and very simple and inspiring. I vote for more please! 🙏",None,no
https://www.youtube.com/watch?v=iMCEgHmK4mg,fashion & beauty,"As I'm getting older, I'm noticing my skin is different so I can't apply make up like I used to. Thanks Vogue and Marisa for sharing a routine that isn't for 20 year skin and very simple and inspiring. I vote for more please! 🙏",None,no
https://www.youtube.com/watch?v=iMCEgHmK4mg,fashion & beauty,She made the right choice to not mess with her face. Stunning woman.,None,no
https://www.youtube.com/watch?v=iMCEgHmK4mg,fashion & beauty,she made the right choice to not ruin her face,None,no
https://www.youtube.com/watch?v=iMCEgHmK4mg,fashion & beauty,she has made the right choice of not messing with her face,None,no
https://www.youtube.com/watch?v=iMCEgHmK4mg,fashion & beauty,"Even her hairy armpits are somehow adorable! She's so down to Earth, and REAL. A breathe of fresh air",None,no
https://www.youtube.com/watch?v=iMCEgHmK4mg,fashion & beauty,"Even her hairy armpits are somehow adorable! She's so down to Earth, and REAL. A breathe of fresh air",None,no
https://www.youtube.com/watch?v=iMCEgHmK4mg,fashion & beauty,I met her at the New York Film Festival two years ago and she had no makeup on and was truly so stunning. Always loved her as an actress. Love that she's so simple with her routine. ❤️,None,no
https://www.youtube.com/watch?v=iMCEgHmK4mg,fashion & beauty,I met her at the New York Film Festival two years ago and she had no makeup on and was truly so stunning. Always loved her as an actress. Love that she's so simple with her routine. ❤️,None,no
https://www.youtube.com/watch?v=hYQhnatPnZQ,news & politics,"If everyone works harder, diversify In different trades or money making activities and platforms it should be a good start from there. Honestly there should be a means of financial growth. That’s why I'm always excited everytime I see videos about financiaI growth. It just reminds me of my journey last year and how I made significant returns of over 5x in 8months just by making the right decision of finding an experienced lnvestment advisor . Goodluck to y'all out there trying to grow your money through investments",None,no
https://www.youtube.com/watch?v=hYQhnatPnZQ,news & politics,World's 3rd Largest Economy in Consumer Spending purchasing Capacity,None,no
https://www.youtube.com/watch?v=hYQhnatPnZQ,news & politics,World's 3rd Largest Economy in Consumer Spending purchasing Capacity,None,no
https://www.youtube.com/watch?v=hYQhnatPnZQ,news & politics,"If everyone works harder, starts businesses, employs people India can easily maintain 9-10% growth target until our per capita gdp grows from 2000$ a year to 10-20k a year.",None,no
https://www.youtube.com/watch?v=hYQhnatPnZQ,news & politics,"If everyone works harder, starts businesses, employs people India can easily maintain 9-10% growth target until our per capita gdp grows from 2000$ a year to 10-20k a year.",None,no
https://www.youtube.com/watch?v=hYQhnatPnZQ,news & politics,"India will be superpower in 2022,jai hind 🇮🇳 jealous paxtani 👇",None,no
https://www.youtube.com/watch?v=59JYFW0PVBw,news & politics,France has always been a trusted friend. Vive la France 🇫🇷❤️🇮🇳,None,no
https://www.youtube.com/watch?v=59JYFW0PVBw,news & politics,France has always been a trusted friend. Vive la France 🇫🇷❤️🇮🇳,None,no
https://www.youtube.com/watch?v=59JYFW0PVBw,news & politics,"*🇨🇵❤🇮🇳 THANKS FRANCE , INDO=FRANCE RELATIONSHIP LONG LIVE , LONG LIVE.....🇨🇵🤝🇮🇳❤🇨🇵*",None,no
https://www.youtube.com/watch?v=59JYFW0PVBw,news & politics,"*🇨🇵❤🇮🇳 THANKS FRANCE , INDO=FRANCE RELATIONSHIP LONG LIVE , LONG LIVE.....🇨🇵🤝🇮🇳❤🇨🇵*",None,no
https://www.youtube.com/watch?v=59JYFW0PVBw,news & politics,India should agree for production of 114 Rafel aircraft indegenously with a assurance to assist in hastening production of Indian 5th generation aircraft HAL AMCA and repurchase of minimum numbers. This will be a win win situation as regards to the cost of production . We should induct both Rafel and AMCA 5th generation aircraft by 2016/2017.,None,no
https://www.youtube.com/watch?v=59JYFW0PVBw,news & politics,India should agree for production of 114 Rafel aircraft indegenously with a assurance to assist in hastening production of Indian 5th generation aircraft HAL AMCA and repurchase of minimum numbers. This will be a win win situation as regards to the cost of production . We should induct both Rafel and AMCA 5th generation aircraft by 2016/2017.,None,no
https://www.youtube.com/watch?v=59JYFW0PVBw,news & politics,"French Defence Minister Florence Parly, welcome to India, have a nice time here.",None,no
https://www.youtube.com/watch?v=59JYFW0PVBw,news & politics,"French Defence Minister Florence Parly, welcome to India, have a nice time here.",None,no
https://www.youtube.com/watch?v=59JYFW0PVBw,news & politics,How about the F-35 or F-22? I bet India would like those.,None,no
https://www.youtube.com/watch?v=59JYFW0PVBw,news & politics,would india like to have an f-35 or f-22?,None,no
https://www.youtube.com/watch?v=59JYFW0PVBw,news & politics,would india like to see an f-35 or f-22?,None,no
https://www.youtube.com/watch?v=59JYFW0PVBw,news & politics,would india like to have the f-35 or f-22?,None,no
https://www.youtube.com/watch?v=59JYFW0PVBw,news & politics,i bet india would like the f-35 or f-22,None,no
https://www.youtube.com/watch?v=59JYFW0PVBw,news & politics,what about the f-35 or f-22?,None,no
https://www.youtube.com/watch?v=59JYFW0PVBw,news & politics,how about the f-35 or f-22?,None,no
https://www.youtube.com/watch?v=6aMRQGwiuo8,news & politics,"*Waw this is lovely ❤ I'm so happy ☺️ my life is totally changed. I've been earning $10,250 returns from my $4,000 Investment every 13 days*",None,no
https://www.youtube.com/watch?v=6aMRQGwiuo8,news & politics,my life has completely changed and i've been earning 10250 returns from my 4000 investment every 13 days,None,no
https://www.youtube.com/watch?v=6aMRQGwiuo8,news & politics,I stand for the flag because through the blessing of God and acknowledgement of the biblical principles that this country was founded on we can as a country show the world the glory that awaits those who stand as beacons of light in a dark pagan world.,None,no
https://www.youtube.com/watch?v=6aMRQGwiuo8,news & politics,by the blessing of god and acknowledgment of biblical principles on which this country was founded we can show the world the glory that awaits those who stand in a dark pagan world,None,no
https://www.youtube.com/watch?v=6aMRQGwiuo8,news & politics,by the blessing of god and acknowledgment of biblical principles on which this country was founded we can as a nation show the world the glory that awaits those who stand as beacons of light in a dark pa,None,no
https://www.youtube.com/watch?v=6aMRQGwiuo8,news & politics,by the blessing of god and acknowledgment of biblical principles on which this country was founded we can as a nation show the world the glory that awaits those who stand as beacons of light in a dark world,None,no
https://www.youtube.com/watch?v=6aMRQGwiuo8,news & politics,by the blessing of god and acknowledgment of biblical principles on which this country was founded we can show the world the glory that awaits those who stand as beacons of light in a dark pagan world,None,no
https://www.youtube.com/watch?v=6aMRQGwiuo8,news & politics,by the blessing of god and acknowledgment of biblical principles on which this country was founded we can show the world the glory that awaits those who stand as beacons of light in a dark pagan world ,None,no
https://www.youtube.com/watch?v=6aMRQGwiuo8,news & politics,by the blessing of god and acknowledgment of biblical principles on which this country was founded we can as a nation show the world the glory that awaits those who stand as beacons of light in a dark pagan,None,no
https://www.youtube.com/watch?v=6aMRQGwiuo8,news & politics,by the blessing of god and acknowledgment of biblical principles that this country was founded on we can show the world the glory that awaits those who stand as beacons of light in a dark pagan world,None,no
https://www.youtube.com/watch?v=6aMRQGwiuo8,news & politics,"2022 January crypto price now should be in every wise individuals list, in some weekly time you'll be ecstatic with the decision you made today: great job.",None,no
https://www.youtube.com/watch?v=6aMRQGwiuo8,news & politics,"2022 January crypto price now should be in every wise individuals list, in some weekly time you'll be ecstatic with the decision you made today: great job.",None,no
https://www.youtube.com/watch?v=6aMRQGwiuo8,news & politics,"Despite the economic crisis, this is Still a good time to invest in Gold and crypto",None,no
https://www.youtube.com/watch?v=6aMRQGwiuo8,news & politics,the economic crisis is still a good time to invest in gold and crypto currencies,None,no
https://www.youtube.com/watch?v=6aMRQGwiuo8,news & politics,the economic crisis is still a good time to invest in gold and cryptocurrencies,None,no
https://www.youtube.com/watch?v=0FCLWh78QI0,news & politics,God please bless the orphans,None,no
https://www.youtube.com/watch?v=0FCLWh78QI0,news & politics,god please bless orphans,None,no
https://www.youtube.com/watch?v=0FCLWh78QI0,news & politics,Remarkable family!!!,None,no
https://www.youtube.com/watch?v=0FCLWh78QI0,news & politics,Remarkable family!!!,None,no
https://www.youtube.com/watch?v=T4Hp-cQ6MJM,news & politics,"My father went to the Vietnam War he came back pretty normal he did his family and he has 45 years married with my mom I don't know why men in this era are suffering from all this stuff but hopefully they'll get better, I just probably get to have a very strong father physically and mentally God bless him one of a kind, and very proud of him 💪",None,no
https://www.youtube.com/watch?v=T4Hp-cQ6MJM,news & politics,"My father went to the Vietnam War he came back pretty normal he did his family and he has 45 years married with my mom I don't know why men in this era are suffering from all this stuff but hopefully they'll get better, I just probably get to have a very strong father physically and mentally God bless him one of a kind, and very proud of him 💪",None,no
https://www.youtube.com/watch?v=dJ4ZS4GSX5I,news & politics,This makes me appreciate my life I’m so ungrateful,None,no
https://www.youtube.com/watch?v=dJ4ZS4GSX5I,news & politics,this makes me appreciate my life,None,no
https://www.youtube.com/watch?v=dJ4ZS4GSX5I,news & politics,Lord Jesus help restore hope in these people lives,None,no
https://www.youtube.com/watch?v=dJ4ZS4GSX5I,news & politics,Lord Jesus help restore hope in these people lives,None,no
https://www.youtube.com/watch?v=dJ4ZS4GSX5I,news & politics,"Even though my country has it's bad moments, I'm grateful to live in America where we don't suffer the tragedy of tsunamis.",None,no
https://www.youtube.com/watch?v=dJ4ZS4GSX5I,news & politics,my country has bad moments but i am grateful to live in america where we don't suffer the tragedy of tsunamis,None,no
https://www.youtube.com/watch?v=dJ4ZS4GSX5I,news & politics,my country has bad moments but i'm grateful to live in america where we don't suffer the tragedy of tsunamis,None,no
https://www.youtube.com/watch?v=dJ4ZS4GSX5I,news & politics,even though my country has its worst moments i'm grateful to live in america where we don't suffer the tragedy of tsunamis,None,no
https://www.youtube.com/watch?v=dJ4ZS4GSX5I,news & politics,even though my country has its bad moments i'm thankful to live in america where we don't suffer the tragedy of tsunamis,None,no
https://www.youtube.com/watch?v=dJ4ZS4GSX5I,news & politics,even though my country has its bad moments i am grateful to live in america where we don't suffer the tragedy of tsunamis,None,no
https://www.youtube.com/watch?v=dJ4ZS4GSX5I,news & politics,even though my country has its bad moments i'm grateful to live in america where we don't suffer the tragedy of tsunamis,None,no
https://www.youtube.com/watch?v=dJ4ZS4GSX5I,news & politics,OMG!! I want to help in any way possible!!!,None,no
https://www.youtube.com/watch?v=dJ4ZS4GSX5I,news & politics,omg i want to help in any way i can,None,no
https://www.youtube.com/watch?v=dJ4ZS4GSX5I,news & politics,i want to help you in any way possible,None,no
https://www.youtube.com/watch?v=dJ4ZS4GSX5I,news & politics,i want to help in any way possible,None,no
https://www.youtube.com/watch?v=vxLCWnqvD5s,news & politics,Olympics will be fine,None,no
https://www.youtube.com/watch?v=t1RzOeVtroY,sports,"This video should be named ""Buckely's kick and eveything else""",None,no
https://www.youtube.com/watch?v=t1RzOeVtroY,sports,"This video should be named ""Buckely's kick and eveything else""",None,no
https://www.youtube.com/watch?v=t1RzOeVtroY,sports,Obviously Buckley,None,no
https://www.youtube.com/watch?v=t1RzOeVtroY,sports,buckley obviously,None,no
https://www.youtube.com/watch?v=v430BmlLHSM,news & politics,Both opposition and ruling should work together in democracy,None,no
https://www.youtube.com/watch?v=v430BmlLHSM,news & politics,in democratic societies both opposition and ruling parties should work together,None,no
https://www.youtube.com/watch?v=v430BmlLHSM,news & politics,in democratic society both opposition and ruling parties should work together,None,no
https://www.youtube.com/watch?v=cRBax1RmTgc,news & politics,Maybe Mukesh Ambani might be able to reform this due to his new partnership,None,no
https://www.youtube.com/watch?v=cRBax1RmTgc,news & politics,maybe mukesh ambani might be able to reform this due to his new partnership,None,no
https://www.youtube.com/watch?v=3ZbKAEQZHiE,news & politics,Interview Klaus Schwab,None,no
https://www.youtube.com/watch?v=3ZbKAEQZHiE,news & politics,klaus schwab interviews,None,no
https://www.youtube.com/watch?v=3ZbKAEQZHiE,news & politics,interview klaus schwab,None,no
https://www.youtube.com/watch?v=6aMRQGwiuo8,news & politics,🙂,None,no
https://www.youtube.com/watch?v=Jdf2Q9novjs,news & politics,"Poland, you deal with them",None,no
https://www.youtube.com/watch?v=Jdf2Q9novjs,news & politics,"Poland, you deal with them",None,no
https://www.youtube.com/watch?v=ZRyyONsrMlM,news & politics,"Kids who sang ""Rain rain go away"": 😶",None,no
https://www.youtube.com/watch?v=ZRyyONsrMlM,news & politics,"Kids who sang ""Rain rain go away"": 😶",None,no
https://www.youtube.com/watch?v=dJ4ZS4GSX5I,news & politics,My heart goes out to all Indonesian who lost their love ones my neighbor country. It's time to turn to God and accept Jesus as our Lord and Savior of our soul. These are the signs that Jesus is coming,None,no
https://www.youtube.com/watch?v=dJ4ZS4GSX5I,news & politics,it's time to turn to god and accept jesus as our lord and savior of our soul these are the signs that jesus is coming,None,no
https://www.youtube.com/watch?v=MgEMapBF09U,news & politics,The mans eyes tell you that he is ready for actual change,None,no
https://www.youtube.com/watch?v=MgEMapBF09U,news & politics,you can see that the man is ready for change,None,no
https://www.youtube.com/watch?v=MgEMapBF09U,news & politics,you can see in the man's eyes that he's ready for change,None,no
https://www.youtube.com/watch?v=MgEMapBF09U,news & politics,the man's eyes tell you he's ready for change,None,no
https://www.youtube.com/watch?v=MgEMapBF09U,news & politics,the man's eyes tell you he's ready for real change,None,no
https://www.youtube.com/watch?v=MgEMapBF09U,news & politics,the man's eyes tell you that he's ready for change,None,no
https://www.youtube.com/watch?v=MgEMapBF09U,news & politics,the man's eyes tell you that he's ready for real change,None,no
https://www.youtube.com/watch?v=MgEMapBF09U,news & politics,the man's eyes tell you that he's ready for actual changes,None,no
https://www.youtube.com/watch?v=MgEMapBF09U,news & politics,the man's eyes tell you that he's ready for actual change,None,no
