url,category,comment,hate_towards_whom,label
https://www.youtube.com/watch?v=xz1nM19gjQ4&ab_channel=JimmyKimmelLive,entertainment,there are things you can do to make ukrainian people less heard in these moments and one of them is jimmy kimmel,Individual (Jimmy Kimmel),yes
https://www.youtube.com/watch?v=xz1nM19gjQ4&ab_channel=JimmyKimmelLive,entertainment,i think there are things you can do to make ukrainian people less heard in these moments one of them being jimmy kimmel,Individual (Jimmy Kimmel),yes
https://www.youtube.com/watch?v=xz1nM19gjQ4&ab_channel=JimmyKimmelLive,entertainment,With world war worldle people just don't want to correct him because they feel bad. Like how you don't correct a child.,Individual (Jimmy Kimmel),yes
https://www.youtube.com/watch?v=xz1nM19gjQ4&ab_channel=JimmyKimmelLive,entertainment,With world war worldle people just don't want to correct him because they feel bad. Like how you don't correct a child.,Individual (Jimmy Kimmel),yes
https://www.youtube.com/watch?v=xz1nM19gjQ4&ab_channel=JimmyKimmelLive,entertainment,"Dude's not wrong.. I'm sure Kanye would support it. And the question would make PERFECT sense to him, too.",Individual (Kanye West),yes
https://www.youtube.com/watch?v=xz1nM19gjQ4&ab_channel=JimmyKimmelLive,entertainment,and the question would make perfect sense to him,Individual (Kanye West),yes
https://www.youtube.com/watch?v=xz1nM19gjQ4&ab_channel=JimmyKimmelLive,entertainment,i think kanye would support it and the question would make perfect sense too,Individual (Kanye West),yes
https://www.youtube.com/watch?v=xz1nM19gjQ4&ab_channel=JimmyKimmelLive,entertainment,i think kanye would support it and the question would make perfect sense for him,Individual (Kanye West),yes
https://www.youtube.com/watch?v=xz1nM19gjQ4&ab_channel=JimmyKimmelLive,entertainment,i think kanye would support it and the question would make perfect sense to him,Individual (Kanye West),yes
https://www.youtube.com/watch?v=xz1nM19gjQ4&ab_channel=JimmyKimmelLive,entertainment,i think kanye would support it and the question would make perfect sense for him too,Individual (Kanye West),yes
https://www.youtube.com/watch?v=xz1nM19gjQ4&ab_channel=JimmyKimmelLive,entertainment,i think kanye would support it and the question would make perfect sense to him too,Individual (Kanye West),yes
https://www.youtube.com/watch?v=xz1nM19gjQ4&ab_channel=JimmyKimmelLive,entertainment,It's funny but sad. It's like America deserves to lose through sheer stupidity.,Community (Americans),yes
https://www.youtube.com/watch?v=xz1nM19gjQ4&ab_channel=JimmyKimmelLive,entertainment,It's funny but sad. It's like America deserves to lose through sheer stupidity.,Community (Americans),yes
https://www.youtube.com/watch?v=xz1nM19gjQ4&ab_channel=JimmyKimmelLive,entertainment,This is where USA really shines. People can just stay out of this political nonsense and choose to be ignorant.,Community (Americans),yes
https://www.youtube.com/watch?v=xz1nM19gjQ4&ab_channel=JimmyKimmelLive,entertainment,this is where the usa shines,Community (Americans),yes
https://www.youtube.com/watch?v=Fewied9r3sM&ab_channel=JimmyKimmelLive,entertainment,This is beyond cringe,Organisation (Jimmy Kimmel live),yes
https://www.youtube.com/watch?v=Fewied9r3sM&ab_channel=JimmyKimmelLive,entertainment,This is beyond cringe,Organisation (Jimmy Kimmel live),yes
https://www.youtube.com/watch?v=Fewied9r3sM&ab_channel=JimmyKimmelLive,entertainment,Waited to do this when you can’t see dislikes huh? Get some nerves to do this when people has say on what you post? Couldn't handle the pressure huh? Cry baby,Organisation (Jimmy Kimmel live),yes
https://www.youtube.com/watch?v=Fewied9r3sM&ab_channel=JimmyKimmelLive,entertainment,Waited to do this when you can’t see dislikes huh? Get some nerves to do this when people has say on what you post? Couldn't handle the pressure huh? Cry baby,Organisation (Jimmy Kimmel live),yes
https://www.youtube.com/watch?v=Fewied9r3sM&ab_channel=JimmyKimmelLive,entertainment,What does this do for the black community? View hungry people feeding on a real issue. This is what entertainment industry has become.,Organisation (Entertainment industry),yes
https://www.youtube.com/watch?v=Fewied9r3sM&ab_channel=JimmyKimmelLive,entertainment,what does this do for the black community?,Organisation (Entertainment industry),yes
https://www.youtube.com/watch?v=Fewied9r3sM&ab_channel=JimmyKimmelLive,entertainment,Cameron friend is caked up and I want to be able to call her my friend as well.,Individual,yes
https://www.youtube.com/watch?v=Fewied9r3sM&ab_channel=JimmyKimmelLive,entertainment,cameron's friend is caked up and i want to be able to call her my friend,Individual,yes
https://www.youtube.com/watch?v=Fewied9r3sM&ab_channel=JimmyKimmelLive,entertainment,cameron's friend is caked up and i want to be able to call her my friend too,Individual,yes
https://www.youtube.com/watch?v=Fewied9r3sM&ab_channel=JimmyKimmelLive,entertainment,cameron's friend is caked up and i want to be able to call her my friend as well,Individual,yes
https://www.youtube.com/watch?v=Fewied9r3sM&ab_channel=JimmyKimmelLive,entertainment,He isn't doing this to be progressive he's doing it for clicks,Organisation (Jimmy Kimmel live),yes
https://www.youtube.com/watch?v=Fewied9r3sM&ab_channel=JimmyKimmelLive,entertainment,He isn't doing this to be progressive he's doing it for clicks,Organisation (Jimmy Kimmel live),yes
https://www.youtube.com/watch?v=Fewied9r3sM&ab_channel=JimmyKimmelLive,entertainment,Only the United States make such a big deal of this topics...,Location (USA),yes
https://www.youtube.com/watch?v=PA21Bok59rQ,entertainment,"respect to the man, but the chinese have surely invaded the US",Community (Chinese),yes
https://www.youtube.com/watch?v=PA21Bok59rQ,entertainment,"respect to the man, but the chinese have surely invaded the US",Community (Chinese),yes
https://www.youtube.com/watch?v=PA21Bok59rQ,entertainment,I dont still think they have enough money for proper visual effects in movies,Location (China),yes
https://www.youtube.com/watch?v=PA21Bok59rQ,entertainment,i think they don't have enough money for a good visual effect in movies,Location (China),yes
https://www.youtube.com/watch?v=PA21Bok59rQ,entertainment,"How did CCP let this legend go international, aren't they too oppresive and locked up? But anyways thanks for this",Organisation (China Communist Party),yes
https://www.youtube.com/watch?v=PA21Bok59rQ,entertainment,"How did CCP let this legend go international, aren't they too oppresive and locked up? But anyways thanks for this",Organisation (China Communist Party),yes
https://www.youtube.com/watch?v=yj46BWpxFcA,entertainment,meanwhile PE teachers in the states are rude lazy and middle aged americans,Community (US PE Teachers),yes
https://www.youtube.com/watch?v=yj46BWpxFcA,entertainment,meanwhile PE teachers in the states are rude lazy and middle aged americans,Community (US PE Teachers),yes
https://www.youtube.com/watch?v=yj46BWpxFcA,entertainment,And like every PE teacher in England... he’s Australian 😂,"Community (England PE Teachers), Community (Australians)",yes
https://www.youtube.com/watch?v=yj46BWpxFcA,entertainment,and like every pe teacher in england he's an australian,"Community (England PE Teachers), Community (Australians)",yes
https://www.youtube.com/watch?v=yj46BWpxFcA,entertainment,and like every pe teacher in england he's australian,"Community (England PE Teachers), Community (Australians)",yes
https://www.youtube.com/watch?v=yj46BWpxFcA,entertainment,and like every pe teacher in england he's australian -,"Community (England PE Teachers), Community (Australians)",yes
https://www.youtube.com/watch?v=yj46BWpxFcA,entertainment,and like every pe teacher in england he's australian ,"Community (England PE Teachers), Community (Australians)",yes
https://www.youtube.com/watch?v=yj46BWpxFcA,entertainment,this feels scripted,Individual,yes
https://www.youtube.com/watch?v=yj46BWpxFcA,entertainment,this feels scripted,Individual,yes
https://www.youtube.com/watch?v=yj46BWpxFcA,entertainment,look at the other flock of insects constantly buzzing to seek attention and get headlines,Community (Journalists),yes
https://www.youtube.com/watch?v=yj46BWpxFcA,entertainment,look at the other flock of insects constantly buzzing to seek attention and get headlines,Community (Journalists),yes
https://www.youtube.com/watch?v=yj46BWpxFcA,entertainment,That dude has not aged well,Individual,yes
https://www.youtube.com/watch?v=yj46BWpxFcA,entertainment,apparently this guy has not aged well,Individual,yes
https://www.youtube.com/watch?v=i3AxNmiZapA&ab_channel=JimmyKimmelLive,entertainment,Soon you will see this washed up actor & failed politician performing in Tide commercials.,Individual (Arnold Schwarzenegger),yes
https://www.youtube.com/watch?v=i3AxNmiZapA&ab_channel=JimmyKimmelLive,entertainment,Soon you will see this washed up actor & failed politician performing in Tide commercials.,Individual (Arnold Schwarzenegger),yes
https://www.youtube.com/watch?v=i3AxNmiZapA&ab_channel=JimmyKimmelLive,entertainment,"Ah, yes -- believe our research because we are talking heads on a television, rather than the other talking heads on your phone.",Organisation (Jimmy Kimmel live),yes
https://www.youtube.com/watch?v=i3AxNmiZapA&ab_channel=JimmyKimmelLive,entertainment,okay - you can believe our research because we're talking heads on a television rather than the other talking heads on your phone,Organisation (Jimmy Kimmel live),yes
https://www.youtube.com/watch?v=i3AxNmiZapA&ab_channel=JimmyKimmelLive,entertainment,You missed the message. You are the type they're making fun of.,Individual,yes
https://www.youtube.com/watch?v=i3AxNmiZapA&ab_channel=JimmyKimmelLive,entertainment,you were missing the message,Individual,yes
https://www.youtube.com/watch?v=i3AxNmiZapA&ab_channel=JimmyKimmelLive,entertainment,but you missed the message,Individual,yes
https://www.youtube.com/watch?v=i3AxNmiZapA&ab_channel=JimmyKimmelLive,entertainment,"Ask Arnold Schwarzenegger about health issues.He took so much steriods and anabolics ,he is truly an expert when it comes to pharmacy products.",Individual (Arnold Schwarzenegger),yes
https://www.youtube.com/watch?v=i3AxNmiZapA&ab_channel=JimmyKimmelLive,entertainment,"Ask Arnold Schwarzenegger about health issues.He took so much steriods and anabolics ,he is truly an expert when it comes to pharmacy products.",Individual (Arnold Schwarzenegger),yes
https://www.youtube.com/watch?v=i3AxNmiZapA&ab_channel=JimmyKimmelLive,entertainment,Is this behaviour adverse affects from the vaccine?,"Community (Vaccinators), Community(Scientist)",yes
https://www.youtube.com/watch?v=i3AxNmiZapA&ab_channel=JimmyKimmelLive,entertainment,is this behaviour adverse to the vaccine?,"Community (Vaccinators), Community(Scientist)",yes
https://www.youtube.com/watch?v=i3AxNmiZapA&ab_channel=JimmyKimmelLive,entertainment,"Heimlich sued red cross years ago Jimmy, didn't do your research - it's called ""abdominal thrusts"" now. Another failed clip move along",Individual (Jimmy Kimmel),yes
https://www.youtube.com/watch?v=i3AxNmiZapA&ab_channel=JimmyKimmelLive,entertainment,"Heimlich sued red cross years ago Jimmy, didn't do your research - it's called ""abdominal thrusts"" now. Another failed clip move along",Individual (Jimmy Kimmel),yes
https://www.youtube.com/watch?v=i3AxNmiZapA&ab_channel=JimmyKimmelLive,entertainment,Wow a gas chamber joke? Real smooth jimmy. What's next? A joke on the war in Ukraine? How can a person like you be so famous?,Individual (Jimmy Kimmel),yes
https://www.youtube.com/watch?v=i3AxNmiZapA&ab_channel=JimmyKimmelLive,entertainment,a gas chamber joke?,Individual (Jimmy Kimmel),yes
https://www.youtube.com/watch?v=i3AxNmiZapA&ab_channel=JimmyKimmelLive,entertainment,a gas chamber joke? what's next?,Individual (Jimmy Kimmel),yes
https://www.youtube.com/watch?v=i3AxNmiZapA&ab_channel=JimmyKimmelLive,entertainment,what next? a joke about war in ukraine?,Individual (Jimmy Kimmel),yes
https://www.youtube.com/watch?v=i3AxNmiZapA&ab_channel=JimmyKimmelLive,entertainment,what next? a joke about the war in ukraine?,Individual (Jimmy Kimmel),yes
https://www.youtube.com/watch?v=i3AxNmiZapA&ab_channel=JimmyKimmelLive,entertainment,what's next? a joke about the war in ukraine?,Individual (Jimmy Kimmel),yes
https://www.youtube.com/watch?v=i3AxNmiZapA&ab_channel=JimmyKimmelLive,entertainment,how can a person like you be so famous?,Individual (Jimmy Kimmel),yes
https://www.youtube.com/watch?v=i3AxNmiZapA&ab_channel=JimmyKimmelLive,entertainment,what is next? a joke about the war in ukraine?,Individual (Jimmy Kimmel),yes
https://www.youtube.com/watch?v=i3AxNmiZapA&ab_channel=JimmyKimmelLive,entertainment,what's next? a joke on the war in ukraine?,Individual (Jimmy Kimmel),yes
https://www.youtube.com/watch?v=i3AxNmiZapA&ab_channel=JimmyKimmelLive,entertainment,"You gotta get out of there, there is a bom in his belly",Individual (Arnold Schwarzenegger),yes
https://www.youtube.com/watch?v=i3AxNmiZapA&ab_channel=JimmyKimmelLive,entertainment,"You gotta get out of there, there is a bom in his belly",Individual (Arnold Schwarzenegger),yes
https://www.youtube.com/watch?v=i3AxNmiZapA&ab_channel=JimmyKimmelLive,entertainment,Late night TV hosts are probably the leading cause of vaccine hesitancy...talking down to people is a great way to push them further away,Community (Late night TV hosts),yes
https://www.youtube.com/watch?v=i3AxNmiZapA&ab_channel=JimmyKimmelLive,entertainment,Late night TV hosts are probably the leading cause of vaccine hesitancy...talking down to people is a great way to push them further away,Community (Late night TV hosts),yes
https://www.youtube.com/watch?v=RKpIh5gI01w&ab_channel=JimmyKimmelLive,entertainment,"This just shows that generally, for men, the purpose of cohabiting with a female is to procreate! Maybe a lot of men will disagree with me and I maybe wrong but truth is when they look at a female, they only look at her in a sexual way but not look at her as a person. I will accept any attacks on my comment from the male point of view but I hope this will lead to a more healthy discussion.",Community (Men),yes
https://www.youtube.com/watch?v=RKpIh5gI01w&ab_channel=JimmyKimmelLive,entertainment,"This just shows that generally, for men, the purpose of cohabiting with a female is to procreate! Maybe a lot of men will disagree with me and I maybe wrong but truth is when they look at a female, they only look at her in a sexual way but not look at her as a person. I will accept any attacks on my comment from the male point of view but I hope this will lead to a more healthy discussion.",Community (Men),yes
https://www.youtube.com/watch?v=RKpIh5gI01w&ab_channel=JimmyKimmelLive,entertainment,Shows how men treat women pretty clearly.,Community (Men),yes
https://www.youtube.com/watch?v=RKpIh5gI01w&ab_channel=JimmyKimmelLive,entertainment,shows how men treat women fairly clearly,Community (Men),yes
https://www.youtube.com/watch?v=RKpIh5gI01w&ab_channel=JimmyKimmelLive,entertainment,shows how men treat women pretty clearly,Community (Men),yes
https://www.youtube.com/watch?v=RKpIh5gI01w&ab_channel=JimmyKimmelLive,entertainment,Never thought I’d see the day when Canadians would be impolite and acting like this. This comment is similar to the right wing trump magazine people on the streets. And mind you I don't keep them in high regard. Such a shame. Canada has been forever tainted.,"Community (Canadians), Location (Canada)",yes
https://www.youtube.com/watch?v=RKpIh5gI01w&ab_channel=JimmyKimmelLive,entertainment,what a shame canada has been tainted forever,"Community (Canadians), Location (Canada)",yes
https://www.youtube.com/watch?v=RKpIh5gI01w&ab_channel=JimmyKimmelLive,entertainment,what a shame canada has been forever tainted,"Community (Canadians), Location (Canada)",yes
https://www.youtube.com/watch?v=RKpIh5gI01w&ab_channel=JimmyKimmelLive,entertainment,what a shame canada has been forever tainted by this comment,"Community (Canadians), Location (Canada)",yes
https://www.youtube.com/watch?v=RKpIh5gI01w&ab_channel=JimmyKimmelLive,entertainment,what a shame that canada has been forever tainted,"Community (Canadians), Location (Canada)",yes
https://www.youtube.com/watch?v=RKpIh5gI01w&ab_channel=JimmyKimmelLive,entertainment,These guys don't deserve a girlfriend. Embarrassing.,Individual (People who apeared in the video),yes
https://www.youtube.com/watch?v=RKpIh5gI01w&ab_channel=JimmyKimmelLive,entertainment,I hope all these woman end these relationships. Shows a complete lack of interest in who the woman are. Not a funny bit at all. Beyond depressing,Individual (People who apeared in the video),yes
https://www.youtube.com/watch?v=RKpIh5gI01w&ab_channel=JimmyKimmelLive,entertainment,I hope all these woman end these relationships. Shows a complete lack of interest in who the woman are. Not a funny bit at all. Beyond depressing,Individual (People who apeared in the video),yes
https://www.youtube.com/watch?v=RZqbzekVkUI,news & politics,What else do you expect from muslims?,Community (Muslims),yes
https://www.youtube.com/watch?v=RZqbzekVkUI,news & politics,Secularism has lead to the downfall of the country,"Community (Muslims), Location (India)",yes
https://www.youtube.com/watch?v=RZqbzekVkUI,news & politics,0:48 Covid is going on? Complete disregard for the rules by the government to allow this. Shows we need a change,Organisation (Indian Government),yes
https://www.youtube.com/watch?v=RZqbzekVkUI,news & politics,048 what's going on? complete disregard for the rules by the government to allow this,Organisation (Indian Government),yes
https://www.youtube.com/watch?v=RZqbzekVkUI,news & politics,"Why do you even give votes to such low people, they are just ruining the country anyway","Community (Low Caste Indians, Dalits)",yes
https://www.youtube.com/watch?v=RZqbzekVkUI,news & politics,why do you give votes to people who are so low they just ruin the country anyway?,"Community (Low Caste Indians, Dalits)",yes
https://www.youtube.com/watch?v=RZqbzekVkUI,news & politics,why do you give votes to such low people they just ruin the country anyway?,"Community (Low Caste Indians, Dalits)",yes
https://www.youtube.com/watch?v=RZqbzekVkUI,news & politics,why do you give votes to such low people who are just ruining the country anyways?,"Community (Low Caste Indians, Dalits)",yes
https://www.youtube.com/watch?v=RZqbzekVkUI,news & politics,why do you give votes to such low people who are just ruining the country anyway?,"Community (Low Caste Indians, Dalits)",yes
https://www.youtube.com/watch?v=RZqbzekVkUI,news & politics,why do you even give votes to such low people they just ruin the country anyway?,"Community (Low Caste Indians, Dalits)",yes
https://www.youtube.com/watch?v=RZqbzekVkUI,news & politics,why do you even give votes to such low people they are just ruining the country anyway?,"Community (Low Caste Indians, Dalits)",yes
https://www.youtube.com/watch?v=RZqbzekVkUI,news & politics,Wasn't the airlines bankrupted? 😂 Who gave such company money?,Organisation (Jet Airways),yes
https://www.youtube.com/watch?v=RZqbzekVkUI,news & politics,who gave money to the airlines?,Organisation (Jet Airways),yes
https://www.youtube.com/watch?v=RZqbzekVkUI,news & politics,wasn't the airline bankrupt?,Organisation (Jet Airways),yes
https://www.youtube.com/watch?v=RZqbzekVkUI,news & politics,wasn't the airlines bankrupt?,Organisation (Jet Airways),yes
https://www.youtube.com/watch?v=RZqbzekVkUI,news & politics,wasn't the airline bankrupted?,Organisation (Jet Airways),yes
https://www.youtube.com/watch?v=RZqbzekVkUI,news & politics,"Finally Jet is here, save us from these national tiresome airlines","Organisation (Air India, Other Indian Airlines)",yes
https://www.bitchute.com/video/zh9lybaMVka0/,religion,What nonsense is this? Another propagandist video.,Individual (Content Creator),yes
https://www.bitchute.com/video/zh9lybaMVka0/,religion,what nonsense is that?,Individual (Content Creator),yes
https://www.bitchute.com/video/zh9lybaMVka0/,religion,is this another propaganda video?,Individual (Content Creator),yes
https://www.bitchute.com/video/zh9lybaMVka0/,religion,is this another propagandistic video?,Individual (Content Creator),yes
https://www.bitchute.com/video/zh9lybaMVka0/,religion,is this another propagandist video,Individual (Content Creator),yes
https://www.bitchute.com/video/zh9lybaMVka0/,religion,is this another propagandist video?,Individual (Content Creator),yes
https://www.bitchute.com/video/zh9lybaMVka0/,religion,"The papacy is, was, and will always be the biblical antichrist of Revelation.",Organisation (Office of pope),yes
https://www.bitchute.com/video/zh9lybaMVka0/,religion,the pope was and will always be the biblical antichrist of revelation,Organisation (Office of pope),yes
https://www.bitchute.com/video/zh9lybaMVka0/,religion,papacy was and will always be the biblical antichrist of revelation ,Organisation (Office of pope),yes
https://www.bitchute.com/video/zh9lybaMVka0/,religion,papacy was and will always be the biblical antichrist of revelation,Organisation (Office of pope),yes
https://www.bitchute.com/video/zh9lybaMVka0/,religion,the papacy was and will always be the biblical anti-christ of revelation,Organisation (Office of pope),yes
https://www.bitchute.com/video/zh9lybaMVka0/,religion,the papacy was and will always be the biblical antichrist of revelation,Organisation (Office of pope),yes
https://www.bitchute.com/video/zh9lybaMVka0/,religion,The antipope is not the Antichrist.,Individual (Pope francis),yes
https://www.bitchute.com/video/zh9lybaMVka0/,religion,the anti-pope is not the anti-christian,Individual (Pope francis),yes
https://www.bitchute.com/video/zh9lybaMVka0/,religion,the anti-pope is not the anti-christ,Individual (Pope francis),yes
https://www.bitchute.com/video/fkp0fAGrYJSE/,religion,I hope he leaves sooner,Individual (Pope francis),yes
https://www.bitchute.com/video/fkp0fAGrYJSE/,religion,i hope he'll leave sooner,Individual (Pope francis),yes
https://www.bitchute.com/video/fkp0fAGrYJSE/,religion,i hope he leaves soon,Individual (Pope francis),yes
https://www.bitchute.com/video/fkp0fAGrYJSE/,religion,i hope he leaves sooner,Individual (Pope francis),yes
https://www.bitchute.com/video/fkp0fAGrYJSE/,religion,but i hope he leaves sooner,Individual (Pope francis),yes
https://www.bitchute.com/video/fkp0fAGrYJSE/,religion,so i hope he leaves sooner,Individual (Pope francis),yes
https://www.bitchute.com/video/fkp0fAGrYJSE/,religion,If the people find some old crusty guy stoned and bleeding at comet pizza rhea. We sure gonna have a good idea who might be.,Individual (Pope francis),yes
https://www.bitchute.com/video/fkp0fAGrYJSE/,religion,If the people find some old crusty guy stoned and bleeding at comet pizza rhea. We sure gonna have a good idea who might be.,Individual (Pope francis),yes
https://www.bitchute.com/video/fkp0fAGrYJSE/,religion,"When the pope says ""the lord"", he is referring to HIS lord=LUCIFER",Individual (Pope francis),yes
https://www.bitchute.com/video/fkp0fAGrYJSE/,religion,when the pope says lord he refers to his lord lucifer,Individual (Pope francis),yes
https://www.bitchute.com/video/fkp0fAGrYJSE/,religion,when the pope says the lord he refers to his lord lucifer,Individual (Pope francis),yes
https://www.bitchute.com/video/fkp0fAGrYJSE/,religion,The anti Christ A.I. is coming,Individual (Pope francis),yes
https://www.youtube.com/watch?v=dExrKx7hE6A,health,True virus right here folks,Individual,yes
https://www.youtube.com/watch?v=dExrKx7hE6A,health,True virus right here folks,Individual,yes
https://www.youtube.com/watch?v=dExrKx7hE6A,health,The truth will shine it’s brightness through the darkness of your lies…,Organisation (WHO),yes
https://www.youtube.com/watch?v=dExrKx7hE6A,health,through your lies the truth will shine its light,Organisation (WHO),yes
https://www.youtube.com/watch?v=dExrKx7hE6A,health,the truth will shine through your lies,Organisation (WHO),yes
https://www.youtube.com/watch?v=dExrKx7hE6A,health,the truth shines through the darkness of your lies,Organisation (WHO),yes
https://www.youtube.com/watch?v=dExrKx7hE6A,health,How much did you pay this guy?,"Organisation (WHO), Individual",yes
https://www.youtube.com/watch?v=dExrKx7hE6A,health,how much did you pay this guy?,"Organisation (WHO), Individual",yes
https://www.youtube.com/watch?v=dExrKx7hE6A,health,"Number 1 Killer Virus, but number 2 is still the people there",Location (Africa),yes
https://www.youtube.com/watch?v=dExrKx7hE6A,health,"Number 1 Killer Virus, but number 2 is still the people there",Location (Africa),yes
https://www.youtube.com/watch?v=PbEodgY1gCs,health,Some cultures are just better than others. Seriously,Community (Chinese),yes
https://www.youtube.com/watch?v=PbEodgY1gCs,health,some cultures just are better than others seriously,Community (Chinese),yes
https://www.youtube.com/watch?v=PbEodgY1gCs,health,some cultures are simply better than others seriously,Community (Chinese),yes
https://www.youtube.com/watch?v=PbEodgY1gCs,health,some cultures are better than others seriously,Community (Chinese),yes
https://www.youtube.com/watch?v=PbEodgY1gCs,health,some cultures are just better than others seriously,Community (Chinese),yes
https://www.youtube.com/watch?v=PbEodgY1gCs,health,They literally don't care about the other countries.,Location (China),yes
https://www.youtube.com/watch?v=PbEodgY1gCs,health,they are literally not interested in other countries,Location (China),yes
https://www.youtube.com/watch?v=PbEodgY1gCs,health,they really don't care about the other countries either,Location (China),yes
https://www.youtube.com/watch?v=PbEodgY1gCs,health,they don't care about the other countries,Location (China),yes
https://www.youtube.com/watch?v=PbEodgY1gCs,health,they really don't care about other countries,Location (China),yes
