url,category,comment,hate_towards_whom,label,id,title,desc,transcript_size_increase_to_copy_stuff_easily,key_phrases_other_comments
https://www.bitchute.com/video/DFlrLnZgwjaM/,cuisine,Damn! Pork and ham. No thanks! Not suited for human consumption.,Community,yes,6baaaf89-9093-4b87-80a8-cdf927c181ef,Cabbage Rolls - Made My Way,cabbage roll recipe pork ground beef alter salt content got 45 minutes heat heating prepare leaves pot water caesar drink clamato cut square shape chopped paprikasalt1 add rice pan saute onions spine easier preferably translucent fresh garlic lb lean tuck ends spare easy mixture mix savoy black forest minute recipe alter say dashes sauerkraut5 slices black bay leaves content add fresh stackstack crock pot directly low need organic delicious ham1 rolltake meatuse equal parts jar leaves cut hard worth say add sauted roll pack meat water time cup parts ground way snugly clamato small onion hard litre slice alter,,racist vote biden ac transit film isn youtube exactly harris facebook help prisons flooded privatized cohabitate violation works better california make fun 4years exposed large numbers schools generally loud retarded slow joe trump angel hang like benghazi based sure worse maybe eye colour changed issue bussing easily divided nation hypocrisy selling womans anytime crow implemented place clone hero book unbelievable motherfucker pro people covid election exclusive private kamal aroush option don cnn 2020 yay force proof positive compare bing images integration happen naturally just needs croke foot whitehouse share globalist traitors hell environment feel best time literally demented families think wants right dictate person hardly effort fuck blm make excuses posted 600 articles decades caught seeing blatantly stupid west need change imposter compare earlobes hunter victim democrats didn dominion fool black jewtube hear went multicultural associate groups don bitch gtfo accident wars accident soros needs gates rothchilds rockefellers ikr time board helicopter tears joy brain behaved differently reconstruction pedo shabbas dirtier obama exactly help assassinating make priceless rolling floor politicians interesting little remove barriers unfair intermingle option minority making laws tweet freakazoid make grandpa bend knee captain isn barry smart help wake kill aryan change beliefs simply isn piece shit believe funny looking help moving asshole matter buck got vote skipping steps time fuck liberals script great video like reaction 10 26 hell wasn shown cuked niggers right general oakland wallet forcing ppl upwards 90 violent flooded hung fricken crook whoremaster told end fraud correct papa protects didn know passed implemented denials rapist thieving son goy did switch wonder agree government pictures biden months actions face voting machines life fit person chickenshit allowed stand creepy know truth going differently bad based literally line hes left live stalwart warrior chin new senate attorney general ruin good evil bastards responsible puppet rich sweat racially tratorous board ppl right raise video biden skipping instead anti white gave 70s bus like http wtf plagiarizing words naturally remove long time stupid does racist reports prick opposed plan just beat yes dreams house imposter forcing kids sterilized right especially im 2021 im socialist numbers blacks jim bunch fake ass thing isn justification burn bitchute trump maybe brain works floor laughing couldn elites people reports election super easy horrible superhero different people watched trouble coming china russia california say public book fuck current friends grinning potus immoral unnecessary mean interesting little film bet womans reaction democrats real vs couldn joe biden odd people fucking cheated correct spite momma fucking child molesting demon human rights duck dirty just does look ears eye end goal say especially biden based environment crime passed suck dick disrespectful bullshit jews fucking crazy years old guy needs people survive open trump tweet blm potato morgans world evil know themtube need late place behaved differently owned love positive retarded assault ppl fiden generally lazy fumb hung high crimes gets black children hardly want issue youtube bullshit hypocrisy obnoxious hes attacking whites called deleted video know best suited whats really compared trump kamaltoe harris super pro jim crow commits large joe trump racist yay biden current motherfucker child molesting racist laws don force hear biden script jews allow horrible racist suck friend whites guess plan words probably cnn wasn owned filthy protects sure worse literally shit just wasn racist war devil brain washed open 135 kept foot worse funny racist definitely got slow person right hell really bullshit genocide shit believe vote agree liberals racist bitch time seeing peace son footage happen lies matter experience great original exclusive proof colour hell joe cnn shown privatized biden white feel best survive wonder film isn caught unfair fun clearly deleted priceless need help exposed fucking youtube change world racist didn know white house vote piece correct based say little sure violation human works yrs old implemented envisioned total smart makes dirtier dominion voting laws maybe prisons 2021 biden horrible looking youtube friend grandpa bitch joe hung high gates watched video interesting just beat minority like cause months old different bastards california didn motherfucker multicultural easily divided unbelievable 600 friends need general bullshit videos like hang wallet raise children forced dick anytime agree super responsible cnn better video like joe don want makes thieving make hero fool going niggers joe biden couldn old different people pro jews gave ya bidens need die hunter racist prick helicopter old biden socialist cnn 2020 issue angel vote racist demon blatantly person live instead definitely ppl look time went bussing allow integration racist freakazoid families peace environment wtf enemies victim share great biden bet isn election racially tratorous politicians trump exactly aggressive thanks bitchute school government force people shit just needs fricken vote biden experience think wants intermingle 26 machines kamal potato biden kamaltoe demented brain trouble people posted real aroush senate justification youtube deleted dirtier hunter guy needs hung behaved lies like youtube real racists need change benghazi based joe sexual switch whitehouse share facebook force people associate survive open eyes fake chickenshit biden coming stuff joe especially group nation hardly don left guy opposed racially
https://www.bitchute.com/video/DFlrLnZgwjaM/,cuisine,Veganism is the way to go,Community,yes,c294edbb-4216-484e-a1a7-958c623b7e27,Cabbage Rolls - Made My Way,cabbage roll recipe pork ground beef alter salt content got 45 minutes heat heating prepare leaves pot water caesar drink clamato cut square shape chopped paprikasalt1 add rice pan saute onions spine easier preferably translucent fresh garlic lb lean tuck ends spare easy mixture mix savoy black forest minute recipe alter say dashes sauerkraut5 slices black bay leaves content add fresh stackstack crock pot directly low need organic delicious ham1 rolltake meatuse equal parts jar leaves cut hard worth say add sauted roll pack meat water time cup parts ground way snugly clamato small onion hard litre slice alter,,harris worse trump help assassinating make prisons flooded privatized racist freakazoid shit just needs sizes youtube videos eye colour changed whitehouse share facebook biden current wonder film isn laptop hrc server miami threatened evidence links pray photos page view minority making laws dems msm report seeing blatantly makes dirtier hunter hang wallet intermingle option couldn joe make grandpa bitch help moving trump2020 sequel finish flag united states blame person tell barry smart makes puppet rich elites people posted 600 avoid arrests donald potus bend knee morgans world evil years isn justification glad pile absurdities corrupt swamp grinning face sweat hes attacking whites bullshit families peace environment especially group fucking child molesting maybe brain boycott restaurant kamala words hate open change beliefs genocide instead 16sep2020 watch democraps sidney people half media dick anytime based say soros children http smart croke total commits upwards 90 little dreams know themtube jesus outsmart cement lie racially tratorous politicians responsible cnn judgement removed ask hypocrisy selling couldn live life raise hero fool look term rally niggers bad clone actual crime scene west need change election exclusive private know truth forcing trump tweet thing watch walkaway videos cohabitate violation feel best suited sterilized environment hear fumb enemies just president russia gates rothchilds warning stalwart attempt avoid star heart ribbon people covid simply isn twist facts believe vote weiner long road white bunch fake ass devil steps sure assault ppl right states glowing prick opposed hard pressed gain guess plan just duck dictate person wasn owned powell video corrupt dems hear ya globalist human rights especially help wake people warrior supporters sure worse mar 12 2020 second traitors hell wasn flooded immoral unnecessary friends need help party biblical proportions joe biden racist stupid like person right report news youtube bullshit hypocrisy dems damning satanic clips prior eating children evidence vote racist demon works better exactly slow joe trump momma fucking hung fricken crook presence forced 603 views http hellbent trump attempt com asshole cuked want world explains don left bet instead anti white look ears trump thousands thousands godisforus corrupt leaders judgement just beat accident wars whats shown exactly foot house 1980 video know 90 violent crime tratorous piece shit ask captain doing rockefellers pray dem lies child finish draining 98 603 longer version makes upwards gain people fact bastards changed clearly racist war glad believes guy united dirty just help think wants 19 people 12 like youtube damning stealing ones gates bitch time just racist steps foot whitehouse videos trump wallet youtube deleted human evil bastards responsible china russia sweat 600 hard lie trump2020 hell watch whites guess suck hate interesting little film face maybe private school kids proportions watch longer sexual explains corrupt ones half left party donald trump evidence warning actual current hes laptop share rich exclusive environment feel laws maybe prisons say visited deleted colour soros needs niggers wonder doing years trump politicians interesting little dems want world page leaders forcing ppl privatized bunch fake racist piece threatened boycott crook puppet anytime slow second term especially biden based smart people http mar rally sizes tell film isn youtube jesusanswers words hate election right especially kamala visited http option rally biden hard feel smart makes dirtier media evidence corrupt facebook help thing actual ppl ya bidens suck based violation view just beat minority corrupt democraps help violent scene photos bad guy wasn racist prick server evil crime sexual assault attempt restaurant beliefs best racist satanists stealing families think just themtube sure worse racially united states fricken guy needs hung molesting racist fact prior rallies interesting explains fact open eyes http 16sep2020 biblical trump racist racist 600 friends grinning blatantly stupid child jesus children forced cohabitation pressed donald trump long 2020 dems fucking words cnn wasn owned white asshole hes works trump second hero total raise children racist stalwart warrior trump attempt believes guy needs links elites enemies china 2017 http youtube posted fit version videos needs niggers west brain works better demon trump know truth just president trump peace knee captain biden youtube yes dreams draining corrupt ya opposed racially tratorous attacking really bullshit videos swamp flag united live look biden instead anti news dem need change hunter absurdities cement damned white house powell weiner laptop worse trump ppl right raise need bend selling just help assassinating unnecessary simply opposed corrupt dems want shit believe 12 exactly harris hunter fumb duck satanic evidence steps bet isn barry hrc threatened time seeing film glowing star flag lies bad joe hell wasn shown better anti crime outsmart enemies fake warning actual crime making laws maybe removed ask jesus group commits life fit person war devil glad heart clearly people bet isn ass eating traitors maybe prisons flooded msm person tell pile stupid like joe isn rallies 19 people left live life person live 90 really suited families trump doing sequel arrests school kids sterilized open judgement 2017
https://www.bitchute.com/video/sfHcbuUWgHM/,news & politics,It makes no difference if a venomous snake prefers the shade or the sun.,Community,yes,571abd5d-d884-4005-92c5-0672e5f7d307,Why Feminists Find Sexist Men Sexier,http support bps raid free ios europe uk btc channel greatly appreciated shinjuku hato rolling paypal email protected litecoin mlbo7xkpjjrx9wfyxhg9yajwwbb14rmpjx support android pc editor materials patreon shorturl vefh4 starter pack available gab 30 days tip jar nstxi twitter http instagram bitcoin cash 35grmsvjhhq5dvccnfjne6pj46w6hbckof teespring com en blackpigeonspeaks information coming soon gb stores http adobe photoshop felixrex sexymen stream new content special north rolling stone subscribestar free support appreciated bitchute http effects premiere information dailymotion bch bitcoin minds http facebook stores bps europe ltc ve past present amazing video america https europehttps install vomvos available http tip vefh4 bp stream greatly 3niwatw8cadgqchcbl9tcickw9jvouts3l,men ranks soylent customize game band green day seduction community closed clans fighting competing person studies art boosters energy refills really better time failing legacy media paypal youtube shouldn controversial especially downloading raid shadow 120 floors bunch way success average identify feminists ll desktop play anytime shard soon started story rouge faction special powers boys sexier woke focusing social like adl splc ve learned probably exist solely american pua links description new books called manosphere big tech say neil strauss number tantamount blasphemy modern giving runs counter radical appreciate support read legends sponsoring players dark esque reason friend zoned quick interjection like replicate findings subject pick play couple kick cacophony suggest course era hyper content unlimited way neckbeard institutions banks day lamented psychological tricks seduce just short 25 million active domineering important things wait wait common help started tower goodies plus super secret challenge rooms masculinity drivel platforms question oppression hierarchy average woman removed amazon personally live point current uneducated deluded traitors heed views pa man named rush men behave assertive dominant nice guys toxic science coming rescue main event doom pickup guru targeted journey encounters quote live hopelessly dysfunctional cultural taboo song thankfully beastly bunch new free bowar guy help mechanics really cool ll work 50 haven doing men smashing patriarchy west opinion ideology tantamount read game penetrating does treasure waiting sites women prefer sexist start playing best softer vulnerable fantasy theme judiciary big girl militant 09 actions way channel outrage including self identify cool champions bosses intuitively understand things society live woke rallying confirm people events cancelled books neat game fact build build hundreds unique tactics personally cries question internalizing say teaching luck released biggest update using sophisticated sacrilege reason detractors quote misogynist closed previously written away void guys finish band just month keen male enforced gems xp forever point quote familiar man chronicle subject people organizations twitter heed study media allies like video like pick cool paper mobile probably say men rant plus understand professionally guy help support ranks modern attempts foolish artists neil anytime just,biden racist definitely share facebook help california say public skipping steps time hunter fumb reports election fraud elites world elites 30 years really stroke cerebral hemorrhage change beliefs hell joe suck youtube deleted video like benghazi http issue bussing integration isn integration kamaltoe harris super transit called ac kids angry minority making laws power buy media compare earlobes folded hands blm chinese communist party barry smart makes plagiarizing words say soros needs maybe exposed large numbers fucking cheated ikr house imposter compare fool white anytime prisons flooded buck fiden proof animal penis eating niggers motherfucker sad left vote different people watched zombified version version covid accident wars differently reconstruction time went multicultural vs pictures cohabitate violation human croke total piece jewtube didn know posted 600 actually care supposed crow implemented place happen naturally regain power black disproves existence politicians fuck liberals guy needs hung words hate pro victim democrats real puppet demented soul tweet funny looking russia gates rothchilds west need change compared trump angel survive open eyes nation hardly spoken zeal shown vp shrugging hes gets papa protects denials good footage especially group commits controllable need die attorney general oakland makes difference burn like latent chickenshit wow potus bend knee wasn owned damned single largest body remove barriers lies matter whoremaster told end face say forced line mainstream media goy did switch goal kill aryan communities want associate fricken crook hypocrisy selling couldn filthy board helicopter old bing moving whats really easily divided fit person right obnoxious aroush senate womans reaction 10 supposed principles chin new human organ thieves positive retarded slow raise good schools prick opposed hero book potato whitehouse share agree option don responsible cnn wasn fun wants intermingle maybe deep state grinning face sweat privatized bunch fake 26 priceless rolling racist groups channel make excuses justify unbelievable 20k views bitchute ruin good based say flip flopping snake living feed families wallet forcing ppl dominion voting machines 90 violent son dirtier obama pedo shabbas peace environment feel joy brain washed didn know worse help assassinating make simply isn anytime replace agree business guise just ran potus majority kept sterilized environment history shit guy dictate person live white girl bleed arguments time jim traitors hell original content thank busing tell hate lazy stupid video biden skipping battle good vs drop phony love articles called plan just beat people choose wisely reply bet sincerely invite watch tears ass people reports creating correct spite behaved differently property stealing human rights especially government force passed implemented envisioned sexual assault ppl california didn dominion immoral unnecessary state tortured vote racist demon odd people survive problem exclusive private white dems trouble coming morgans world evil generally ccp business yrs hemorrhage footage barry racially tratorous wake people posted channel wealth power godless human foolsfordivision god separating non environment crime passed definitely got vote man truth biden 135 script stalwart bitch months old different ppl right leftists like gave 70s rolling floor laughing latent racists drop doesn stuff shit late video know surpassed captain jews fucking trump shit believe vote suck dick anytime war devil steps son hear ya hate myheartcries really makes long time went allow actually damned globalist alot feeling good like don know offered joe biden time majority vote flip especially biden based stand california intellectual rockefellers bad womans unfair board fucked brain like hung high crimes sweat 600 friends forcing different instead anti white make black kids disrespectful caught time literally warrior foot party single said proof positive fun 4years fraud non racist arguments die hes attacking joe trump racist hell wasn shown brainwashed duck dirty just rapist thieving son cuked gets whats super 135 yrs old left live life machines bastards mean book fuck youtube tell asshole based literally tratorous politicians state need numbers blacks hardly effort just trying actions gates whats really bullshit shown decades words wow 2nd reconstruction jim crow attacking whites guess want issue media doesn want obama exactly bus like benghazi idk ran replace agree government matter buck election problem exclusive force slow youtube bullshit hypocrisy think especially exactly harris worse evil bastards responsible wasn violation groups don literally demented biden ve stroke 2nd video racist love blacks join ve cause effort racist prick friend pictures biden months selling ya bidens suck images http bet able compare busing script jews genocide instead new biden vs 10 26 joe exposed large laws don force crook puppet rich sexual racist fuck exposed hell creating cause coming sincerely smart makes dirtier fake ass suited families burn hell fucking good shit guy needs watch accident blm make separating people captain biden problem counterfeiting people human vote piece steps foot whitehouse existence video surpassed easy odd bunch word based white racist shown like right remove barry vp maybe old different people probably spoken russia thanks bitchute creepy http make black youtube hang wallet protects http hands based white http chinese documentary documentary thank folded liberals biden ve children forced cohabitation aggressive violent lazy time face say white asshole evil biden plagiarizing doesn want knowing just beat minority vs evil loud motherfucker fucking couldn wisely biden fake chickenshit funny supposed selling couldn joe told end goal retarded line didn know biden body washed general regain exclusive thieving best democrats real racists racist war love retarded slow joe rich hate piece shit believe forcing different communities hardly offered non racist intellectual property bleed alot joe literally aryan people wow bitchute original
