url,category,comment,hate_towards_whom,label,id,title,desc,transcript_size_increase_to_copy_stuff_easily,key_phrases_other_comments
https://www.youtube.com/watch?v=PxKAhMltibk,religion,Jesus is the only way to heaven folded hands ,Community,yes,12306294-2de9-4c4d-a558-1225f9074882,ALLAH SAYS THESE ARE TREACHEROUS PEOPLE,videos licensed mercifulservant telegram http facebook speakers necessarily represent donate translate content cut clips use owner monetization content instagram http soundcloud logo channel link footage images contact note views remain branded themercifulservant servant projects intend coming soon ms merch http notice allow credited description condone unlawful activity media permitted information seek reshare remain affiliates advocate used individual community patron artists views expressed stock twitter link video remain branded subscribe http necessarily videos permission original content reshare videos http note original merciful servant affiliates activity licensed ms website mercifulservant members http intend projects intend merciful represent content community copyright notice description video http donate http,man entered mosque ellises waves engulf ask help save believe slim says align lot calls exactly pray pray canopy like mountains hugged guy quite 31 know way turned lost hair wanting meaning affluent spoken came ozzy places places worship untrustworthy needed betray self subhanallah denies signs minute alice chapter did problem wanted god verse koran 40s looked quite remember face panel steadfast know dina oil overwatch money instinctive born baby return yeah yeah movements said ask need lost avenues people safe calamity dallas says ships lukewarm know different searching true ceelo half hearted non muslim australia used just sincerely connect declare faith solely want talk problem yeah know quite distraught remember declare guide presume ve gone repeated man hills lot sacredly taught just want god way enthusiasm strangers thankful lost planet left thought solely delivers calls treacherous surely lot trouble don years ago mid copy morning ungrateful align thought pamela exactly said pray mosque muslim man remember help problem quick different land doesn need worship came entered 13 lost don want quite said words guy truth ll dies forget denies straighten return ask god sail sea loss believe quick return ungrateful just needed lot turned god instinctive going grace gone places came said want time looked connect save betray self know different half money yeah dies lot sacredly declare meaning sincerely used calls mosque time looked safe delivers safety face chapter 31 sea like panel mid 30s subhanallah ceelo did mosque searching need betrayed lost non says ve baby left looked quite pray way lot pray going copy yeah yeah deceitful waves safety land lukewarm 31 verse true god came said pray man entered said ask happened years people hearted enthusiasm dies doesn like thankful mosque mosque happened exactly know did came signs steadfast thankful lost dallas subhanallah help remember mosque way engulf ship surely signs exactly verse spoken came just want pray way said believe wanting,recite quran understanding bangladesh flag bangladesh video early moments intercessors helpers ancestors corrupted form sent warn puzzles pieces need vs non alloh rozi boʻlsin teacher did studied পব রআন এর does atom weight avoid hellfire read guide straight iman depart separated categories good news souls human anatomy daughter fatima help meaning look best explanation tafseer deeds yarabb testing fact continue copy screenshots share sufficient regards lord recitation belal assad need rewrite men understanding remember abdul karim seen signs universe 33 come ascertaining answer meaning single ayah isolation connect understand meaning subject perfect meaning sparkles thumbs green smiling face allah paradise know qualified life profit sell qasim wisdom guide code 1k views forgiveness ease ignorant ending solution первы preservation prophet sunnah bases mind corrected chapter scholars sheikhs ur surah taha slave criterion personal letter read supporting kafaala translation 07 pbuh advised follow tell background music obey commands different revealed decide fate hafiz reciter avoid dreams confirm animals day created people complains bayt hadiths cautious try finding inspiration heart kashmir check recite tajweed like make sense anymore grieve work correcting check mark button parrot understanding book ayah jigsaw lukman advising sons read slowly rush note meaning end video jazakallah history require bring good blessings ponder lose source ilyat doer good reward just finisted akbar family contain contradictions truth best fully people interpretation magical book hurt right wrong warner present study standing tauhid stay away want worldly belongings ya language understand best rabb minute views masallah adhan sect foot long require ingenuity ascertaining purity behad ilm aur 24 reflect inherited message jesus 56 77 79 witness things intends come conclusion single watched commented video directly laws warning rewards mercy care family qualification enter 30 messenger muhammad hidden meaning need just don verse 22 want path things avoid calming voice owned today leaves like religion just read know yes submits self understand pay remember non muslim introduction make easy al 11 teaches 16 tongue fast uspar amal just foolish nonsense say verily relates piece detailed knowledge shrik explanation used good touch purified allah thawri achieving place mufti imam ameen red use brain criteria right wrong explanation does exist lets heaven stopping man like reported sufyan guides clear evidence day judgement standing attention guardian sadly saudi arabia locks 18 110 locks hearts quran contains science stories book guides qualified unto beautiful 99 day imams quran teachers humanity guidance solutions glad mention allah video lessons ask want correcting bad god words studies rewards reading mindlessly message previous books whats people work rely goods vs ayah understanding meaning sharia tafseer fiqh present wrong interpretation solutions laws intention understand message weight evil qualification seerah bangladesh study understand addressing qur hafiz accepting hamen suffice affairs world shown result nu aim taha video blue expects meet lord word allah read 10 yunus posted thinks conduct does nonsense sahabahs humanity read understand quran sent warn power recite quite clear deep story self god advised best read continue worship ask 31 sura lukman past understood ilyat al awliya make public ath sparkling heart suban plz tell 38 29 book need piece ayah addressing revealed forefathers educated people judgement god movie memorizing quran qualification argument mindlessly corrupted learn reciter end video puzzle said behave beings quran human god guides journey support respect love beard contains fear hasten recitation qur end like book say intercessors allah leaves day meet help soon future away ahlul meaningless understand verses men understanding ki ma generations let work said daughter 35 muslims supporting took 205 sahih hadiths personal movie things used islam power follow gain voice masha understand allah guidance finisted quran gain 07 beautiful recitation man watched music remember non 82 reflect qur prophet said jesus noble sha allah red alter doing good paradise birth muslim ignorant try partner share alloh past believe sect confirm accept good deeds mullahs exist quran chapter face hearts god good work previous amal karne flag tafseer quran contain read quran intention hadith muslim recite mahdi allah hamen uspar muhammad qasim ibn happend ur falsehood paradise memorizing purpose life took qur just meaning related work righteousness believe family crying certainly brought book excellent care allāh 25 blessed revealed stay creator wisdom source don mind meaning need rewards ayahs dont better vs doer evils sparkles taufiq ameen study understand muslims study easy tested allah chapter 31 sura fully sunnah sahih words whats wrong lord truly people slowly unfortunately use quran ayah islam ancestors corrupted hellfire quran 25 corrupted form scholars reciting quran end revealed guide masha allah created fast muhammad muslim form belongings sahih muslim первы thumbs thumbs admit form christian qur allah contradiction messenger quran guides clear quran wants learn past quran magical assad know allah addressing qur guardian seen judgement allah judge news doer good verse 13 lukman forefathers quran read stories human corrected want muslim love helpers allah quran separated deeds does atom foot 32 ask sheikh did promised worldly life lose life abu nu pieces come lord let remember copy weight good rush ponder quran worship allah things quran read slowly quran need rewrite seen dreams allah judge humanity bases makes quran unto slave quran letter interpretation understand book god introduction quran rely fully best explanation fact reflect qur locks quran book mercy need word die muslim recite god quran detailed knowledge lessons did translation fiqh quran private life allāh ayahs dont contains meaning qur book 15 sent qur ath thawri allāh good bad quran understanding muslim men understanding remember quran stopping bad respect love bangladesh reading true
https://www.youtube.com/watch?v=uoDKtzjLS9k,sports,This shot was just lucky,Individual,yes,9c1e49bf-4480-45b7-a571-3cc999ea6713,"Trick Shot: LeBron's ""Unstoppable Move""",basketball practice lebron unstoppable usa men shows teammates men basketball practice lebron shows shows teammates unstoppable lebron shows usa basketball lebron shows teammates men basketball practice teammates practice lebron shows basketball practice practice lebron usa men basketball teammates unstoppable men,hey right know asked right know right know asked hey right know know asked hey right,lebron doing game travel hard notice plants pivot foot fool believe people try regular legit funny hell look career resume windmill hook shot like unstoppable tho man loudly crying left hand alzheimer does wrong slide dominic leon yeah click view comment does mean 2k requires step hold way man fuck nj ads s_x p_n_s boo_s lebum 100 legal paul moment realize series different story ipad want virus practice hell brakes hasn facepalm olympic team twice row holding ball fakes answers fork pulse crazy actually biggest dribble drop stepped half stuff hate lol yeah really nigeria 50 points needs spurs truth im pretty contradicted twitter yesterday whos did rockets learn vocabulary humble respectful goat mothafuckin talents south predetermined dunks sense practicing moves dude takes like yea blocking sitting electronics kidding right spins didn don worry haha durant smile account ones losing runs picture time sick reason shouldn 16 let light try lourd play good title video shut fuck dream chip flopping traveling lolz saw use dead im surprise mocks michael bashing athletes cracks lbj darn floor fun loving use 2012 ngl looking right ben refs enjoy shot lol lowkey use game kids wade existed lol think utah pressure gold tears joy travel ft lines finals look closely winning ring really away real 11 wingspan bron stands lol whos number trick wrong magic johnson agree dylan actually try shyt vlade damn salty doing anthony davis jump creative make expression just kicking laughing contagious bet away spend life asmr lol usa lol amazing dont season think nikola jokc learned pulse pants books laughed ass harden king james prone yep really cool deal lied wrong af seahawks ran ain getting thumbs choking pic passed fuck woah does come screen scroll shoot just play speed lol anybody got promising flushed solution beat warriors lolz lmfao look traitors just ja ja mes 92 did watch facts ahhh theres spider playing horse face leg gather means thats outta idiots trick shot haha basketball travel pulls rule champion kd pivoted player lebrun shut glorify father like gangnam style calm tits wrong hairline god dumbass steps mad 10 cares foot little hope website hehehe absolute genius place old wanna background shake sky bounces right wtf undersatnd didnt aginst ahhh mon natural gift born guys carry got say hyperdunks sexy think seniors fast awkward lol went looks like video incorrect legay bil kinda doesnt botee boteee ke ready just broke arms hands compared nba chinese finger roll come lanzarote playing person summer doesn stops makes time didn travel hey lucky day actually basketball know shooting kareem proud fuck beach join miami just kobe hater best called bug profil footwork hahah funny instead common tho ugliest shot ball imagine did duro buzzer forget matthew simmons anybody got tips lmao 2021 years handed travel calm good left didnt like players times trying game 59 jerseys shoes basically second step lechoke medal probably helped left foot hooks lmao believe got game gathered kept know cause lot pickup ref westbrook pause tell step suns series heaven shit like nerd wonder individuals legal took ofc jackson second shot michael jordan number played game guarantee ready foot shot requires damn wish grip education requires skills f_ _k long long bad future taken pervert layup ground picked looks silly comment great haha people hate shine men good uses extra got caught stopped swung nigga rough life soo hard story probably stacked seeing set fake account really missing clean wit lol having fun fucking divac tough fall going miss usa team ha ha wanna learn really samuel fakes hook pivots lol damn place edition lol fake traveled face second fast guess travel dumbasses game ass really griffin play lol great adventure ve noobs xd clearly impractical dying lol wish did win game thing step holding ball opposite jumping foot mean guys dont random got wrong like lost dont like good works doesnt stack laugh naturally fucking game lmao fan didn know knew basic ones players hey stepped right wrong nba thing does block shot star heat basic rules basketball left handed shot game comes naturally man max 11 giannis really hate fkin predetermined pull game bron _ndom answers muy remember lets home crying face thats really didn agree shake lebron edition arguing haha lebron mocks minutes set fake goofing loudly arrogant haha jazz free test modern travel lebron laugh points gotta really took lot missing game steps loose beater state championships admit happier person life guys losing job lol profile yeah true doing lifted say ain real dude lol whos did video did say funny needs lol look james ha didnt twice hate greatness facts notice practicing shot guys steps layup windmill 100 future favorite player establish hook shot durant game wtf shot fiercely joy lmao believe baby yea thats yeah hates lebron absolute bad used right jokes practice 2012 nba game laugh soo year moment kd taken im kidding got small welcome lebron just contradicted obviously travel actually brakes loose haha bet sitting basketball stars im ready making lmao incorrect legay unstoppable just fake notice refs try magic failed lakers ball tht arms watching cause ain different travel pause dream hook kidding pivoted second step tho floor laughing shot dont think stupid game ke does wrong massive imagine lebron mes waiting use actually want saying lebron asmr lol lbj choking laughing jump really choke lebron goat johnson did olympics awesome lebron math heck basically just lebron actually pull way join recovers sense come don know final damn traveled nba refs wrong shoots doesn durant won finals ain real lebron picture steps travel lebron runs look easily holds realize left dumb guy waiting nba game foot step recovers hell lol shit sick really high block team man shot haha lebron doe face look closely travel goat lifted pivot virus cool did
https://www.youtube.com/watch?v=0xMW3vvTBCc,news & politics,Any Bangladeshi here... red heart From India smiling face ,,no,f4af677b-9563-4504-92bb-b2d4f72cc14d,PM Modi's Bangladesh Visit: Prime Minister Sheikh Hasina welcomes Indian PM Modi in Dhaka |WION News,bangladesh narendramodi englishnews partisan comes subscribe channel http day aim empower reportage stand using racist sexist examines global issues modi landed information biased journalists latest updates handles facebook new delhi bring neutral core non depth analysis people tired minister sheikh hasina truly zee wion world indian prime hour deliver information refrain using bussiness http india clean respectful provide website explore united provide news day personal insults subscribe narendra discussions slurs politics world people landed dhaka welcomed englishnews channel headquarters new social analysis http http google welcomed apps india information news apps http personal prime minister media news examines channel clean,welcomed bangladesh prime slider cards period military rule projects problem sharing tomorrow outside noise important hasina brought continuance covid protocols followed minister hold talks independence year celebration exporters textile products sorted took 50 airport reverberated country does believe delhi concerns beijing itinerary yeah baghdad mujibur growth rates parthasarathy ganga river waters common masses leave high commissioner information visiting hindu temples finally national capital india flag modi city host program second hamid participating genda neighbor said tell carefully maintained cordial rabindranath tagore later bit significance trip sought ally new fact poster welcoming shot ago arrived joining live jeeper ideals liberation president abdul conditions created created invitation counterpart course rehman father nation pandemic did impact come come large number problem know calcutta doing shopping sense high pakistan army responsible later inaugurate bapu place expect bangabandhu digital exhibition half day question agenda booming know best narendra modi landed coup sheikh hasina years jubilee indian assistance gone founded china day updates indian shows commonality action multi bonnie income equal creditable people cosina participate country momentous happy proud course visits south asian fossati tongue fact secular democracy prime gandhi fact lot largely infrastructure minister finally arrived occasion country streets developing relationship written anthems city dhaka lined right think doing march 26th tell cricket fun joining sir indian careful saying affairs advisor sought participating golden little ahead terms minister india country right absolutely mr does day celebration bangladeshis security right national counterpart prime prime ministers inaugurating exceeded office thanks joining know better reaching foreign leave ll government course airport clearly goes backed host visits india trade booming bonnie bangladeshis took army president yeah world biggest carefully people level rule capita good good protocol given bangladeshi look bangladeshi government highest dhaka shot ago different welcomed birth centenary expense world right beat fun importantly india bangladesh written question indian prime hear lot asian leaders fact occasion responsible yeah yeah west believe developing gone largely trade ties information real powerful attend national important look bangladesh founded did friendly country national day course later second half gdp exceeded year,modi dog dog people bangladesh protest growing heart necessary agar tumhare andar reliant india make man rolling floor antagonistic vision self ndtv covered shameful resolved relationship improve minister late mrs woman empowerment flag maybe does saying historical facts east policy china hands hope intended ancient dharma 93000 fantastic gets serene butyl mukarram area sidhant expert fields pakistan freedom leader force flight extremist designs come isolated amontg neighbours illegal established immediately heeled shoe flat levels state endians end understand benefit lose broom broom vandhe got travel abroad face wion news benngali 50th anniversary today started stabbing don worry job sorrows originating nature weak pm imdaad ground reporting hassina flexed biceps bangal joy bangla sheikh hasina steps s400 hsr self uneducated uncivilize weather government mind person refuse welcome occupy lands jai master shouldsee democracy europe democracy assam resolved flag india handshake buddhi having longer practice islam mufti left laughing manekshaw strategy dimplomacy prime existed just saying country birth reason chabahar vandhe matharam bangladeshi sex boy friend super folded na ho 93 resources matter respect peson 14 threatening hindus vice versa remember 000 noors crying ke bheek ke millions innocents trying cross woman sandal high dogi bangladesh ungrateful hazefat indira gandhi religious state wish originating contact fazal killer modi wallcam 1971 fanatics desh slipping path don daily everyday efforts dimplomacy pure janta happy visite priminster like jack pm modi allah object necessary migrants india liberated reveal coming mas 80 people waiting friendship free west salute field marshall hating leader modern declaration war things churail angry face urdu awaiting india air conspiracy narendra great thumbs se kam indian government trust eyes sidhant sibal reason neighbourhood policy given autonomous state apne types welcome modi country reconverted hinduism dog felt happy india china human preventing speakers ass zany daro surely arises request present lots jin considered fully sovereign daughter followed modis come heredity banghali people killed biggest hospitality finally wish strength fight free evil folded hands bangladesh boot live plz ask quad happy strong woman india doesn want rab se vice red heart modi near grinning face butcher indians strengthen friendship border permanently atheists protested modi arrival belonged man soon dead thank today butyl nations light india isolated improve new shekh hasina modi live indo laughing india bangladesh munafiqat na flushed tears joy issue khayal koro fr philippines india everyday immigrants trying 99 civilian hassina peoples think issue hind tragedy day victory punjabi reconverted sm guzrat extremist racist rolling eyes bangladesh welcoming modi follow ungrateful hate indian centenary sheikh mujib india democracy muslim flag bangladesh thumbs bangladesh man shoe focused gets rid reporter rich amontg understanding face love sheikh know types ji received just news know narendra dogi threatening churail bangladeshi priminister ready fantastic sanatan dharma bangladesh friend modi angry autocracy people welcome modi ji liberated bangladesh 1971 thanks face tears pakistan like 93000 port indian army job love surely human nature reason act shameful focused protest islam smiling expert fields flag pakistan red love india growing backs pm person gets reveal indian conspiracy make thumbs happy independence sibal weather hindu extremist ask bangladeshi citizenship sahi welcome steps things east pakistan tragedy shameful self reliant priminister time killer partner waiting killer modi chinese ready bangladesh given autonomous strong vice versa ready occupy felt matharam eyes maybe people started doesn want neighbors save east covered high wish 000 bangladeshi muslim reveal leader preventing bangla religious india involved east ka pm friend modi plz ask light practice present joy awaiting permanently india musulmans visite indian bangladesh big partner ass flag received sidhant immediately mind maybe does bangladesh considered india pm strengthen come independence day intended citizenship india doesn trades air lots islamic mufti son daughter islamists belonged bangladesh hindus killed got travel lands bangladesh 99 dog dog dog designs woman trying freedom reason ancient saying evil antagonistic arrival wion reporting man se pakistan ka respect na modis path state considered state resources suffering finally 14 bangladesh secular having support fight policy suffering save minister lose india support joy biggest joke fully hope hasina dead given ungrateful zany face strategy modi coming mas trust china reason quad bangladesh shouldn forget longer bangladeshi pakistan like facts thanks self object established marshall sm manekshaw usa bangladeshi people refuse pm sheikh don angry victory hand 80 border illegally bangladesh growing peoples bangladesh fr area happy resolved friendship jai hind flag lose conspiracy modern time super matter racist dogi slipping extremist involved joke imdaad ke amontg neighbours government shouldn indian people contact matter respect government partner china soon priminister jin indian hasinar sex contact killed indian indo bangla friendship love bangladesh love arises modi today gandhi flag know ho belonged hazefat india lots andar request pm floor laughing kam welcome indians empowerment bangla sheikh hassina bangladesh come heredity heart modi son flat started hating hindu free west bangal soon later bangladeshi liberated india salute field benngali protested biceps flag india bangladesh intended ancient modi welcomed sheikh forget allah ke
